case_number,incident_code,reported,disposition,start_occurred,end_occurred,location,newreported
23004274,TRESPASSING,12/30/2023 03:45,Closed - Non-Criminal Case,12/30/2023 02:30,12/30/2023 03:45,300 N 17th St,2023-12-30T03:45:00Z
23004269,LOST OR STOLEN ITEM,12/29/2023 14:01,Closed - Non-Criminal Case,12/26/2023 00:00,NULL,2222 Vine St,2023-12-29T14:01:00Z
23004263,MISC - OTHER,12/27/2023 19:01,Closed - Non-Criminal Case,12/22/2023 20:00,12/27/2023 17:45,900 N 16th St,2023-12-27T19:01:00Z
23004258,"PROPERTY DAMAGE - UNINTENTIONAL,NON TRAFFIC",12/26/2023 11:03,Open,12/21/2023 16:30,12/22/2023 06:30,1335 U St,2023-12-26T11:03:00Z
23004255,DISTURBANCE - OTHER,12/25/2023 14:25,Closed - Inactive,12/11/2023 14:00,12/24/2023 16:00,5531 S 74th St,2023-12-25T14:25:00Z
23004252,TRESPASSING,12/23/2023 20:43,Closed - Non-Criminal Case,12/23/2023 20:43,NULL,1111 N 14th St,2023-12-23T20:43:00Z
23004239,FALSE INFORMATION - GIVEN TO OFC.,12/22/2023 02:24,Closed - Cleared by Arrest-Adult,12/22/2023 02:24,NULL,1150 N 14th St,2023-12-22T02:24:00Z
23004238,TRESPASSING,12/21/2023 23:56,Closed - Cleared by Arrest-Adult,12/21/2023 23:56,NULL,1875 N 38th St,2023-12-21T23:56:00Z
23004231,DISTURBANCE - OTHER,12/21/2023 13:07,Closed - Non-Criminal Case,NULL,NULL,300 N 17th St,2023-12-21T13:07:00Z
23004228,OUTSIDE - O.P.S. OTHER,12/21/2023 03:25,Closed - Non-Criminal Case,12/21/2023 03:25,NULL,820 Charleston St,2023-12-21T03:25:00Z
23004225,DISTURBANCE - OTHER,12/20/2023 16:10,Closed - Non-Criminal Case,12/20/2023 15:40,12/20/2023 15:48,1248 R St,2023-12-20T16:10:00Z
23004222,SS - CHECK WELFARE OF PERSON,12/19/2023 17:08,Closed - Non-Criminal Case,12/19/2023 17:08,NULL,1248 R St,2023-12-19T17:08:00Z
23004221,VANDALISM - OTHER,12/19/2023 16:49,Closed - Inactive,12/19/2023 16:49,NULL,1360 Vine St,2023-12-19T16:49:00Z
23004220,VANDALISM - OTHER,12/19/2023 15:56,Closed - Inactive,12/19/2023 15:53,NULL,300 N 17th St,2023-12-19T15:56:00Z
23004213,VANDALISM - OTHER,12/18/2023 14:42,Closed - Inactive,7/1/2023 00:00,12/17/2023 15:30,1800 N 33rd St,2023-12-18T14:42:00Z
OS23012,SEX OFFENSE - MOLEST/FONDLING,12/18/2023 13:32,NA - Clery Report Only,9/5/2023 12:00,NULL,Residence Hall,2023-12-18T13:32:00Z
OS23011,SEX OFFENSE - RAPE,12/18/2023 13:27,NA - Clery Report Only,3/1/2022 12:00,NULL,On Campus,2023-12-18T13:27:00Z
OS23010,SEX OFFENSE - RAPE,12/18/2023 13:17,NA - Clery Report Only,9/1/2023 12:00,9/30/2023 12:00,Residence Hall,2023-12-18T13:17:00Z
23004207,ALCOHOL - DWI,12/17/2023 01:31,Closed - Cleared by Arrest-Adult,12/17/2023 01:31,NULL,N 17TH ST & Q ST,2023-12-17T01:31:00Z
23004195,NARCOTICS - POSSESSION,12/15/2023 23:12,Closed - Cleared by Arrest-Adult,12/15/2023 23:12,NULL,ANTELOPE VALLEY PARKWAY & VINE ST,2023-12-15T23:12:00Z
23004194,NARCOTICS - POSSESSION,12/15/2023 22:43,Closed - Cleared by Arrest-Adult,12/15/2023 22:43,NULL,N 17TH ST & Y ST,2023-12-15T22:43:00Z
23004193,ACCIDENTS - P.D. H&R NOT REPORTABLE,12/15/2023 22:05,Closed - Inactive,12/15/2023 18:30,12/15/2023 22:05,1880 Transformation Dr,2023-12-15T22:05:00Z
23004181,NARCOTICS - POSSESSION,12/14/2023 22:33,Closed - Non-Criminal Case,NULL,NULL,N 19TH ST & S ST,2023-12-14T22:33:00Z
23004179,TRESPASSING,12/14/2023 18:04,Closed - Cleared by Arrest-Adult,12/14/2023 18:04,NULL,550 N 19th St,2023-12-14T18:04:00Z
23004178,DISTURBANCE - DOMESTIC,12/14/2023 17:02,Closed - Inactive,12/14/2023 16:45,12/14/2023 17:02,1700 Y St,2023-12-14T17:02:00Z
23004168,FIRE - FALSE ALARM,12/14/2023 02:31,Closed - Inactive,12/14/2023 02:31,NULL,1120 N 14th St,2023-12-14T02:31:00Z
23004167,ASSAULT - NON DOMESTIC,12/14/2023 01:41,Closed - Inactive,12/14/2023 01:41,NULL,N 15TH ST & P ST,2023-12-14T01:41:00Z
23004161,TELEPHONE - THREATENING CALLS,12/13/2023 18:24,Closed - Non-Criminal Case,12/13/2023 17:32,NULL,1500 U St,2023-12-13T18:24:00Z
23004156,ACCIDENTS - P.D. H&R NOT REPORTABLE,12/13/2023 10:55,Closed - Unfounded,12/12/2023 08:00,12/12/2023 13:00,3940 Fair St,2023-12-13T10:55:00Z
23004153,LARCENY - STOLEN BIKE,12/12/2023 18:21,Closed - Cleared by Arrest-Adult,12/12/2023 13:00,12/12/2023 18:15,855 N 16th St,2023-12-12T18:21:00Z
23004151,VANDALISM - OTHER,12/12/2023 14:04,Closed - Inactive,12/6/2023 09:30,12/6/2023 11:45,200 Centennial Mall N,2023-12-12T14:04:00Z
23004146,LARCENY - OTHER OR FROM OPEN AREA,12/11/2023 22:21,Closed - Cleared by Arrest-Adult,12/11/2023 19:00,12/11/2023 22:00,730 N 14th St,2023-12-11T22:21:00Z
23004135,DISTURBANCE - OTHER,12/11/2023 11:23,Closed - Inactive,12/9/2023 04:49,NULL,NA,2023-12-11T11:23:00Z
23004134,"PROPERTY DAMAGE - UNINTENTIONAL,NON TRAFFIC",12/11/2023 10:43,Closed - Non-Criminal Case,12/11/2023 10:43,NULL,660 N 12th St,2023-12-11T10:43:00Z
23004123,NARCOTICS - OTHER,12/10/2023 00:56,Closed - Inactive,12/10/2023 00:56,NULL,1055 N 16th St,2023-12-10T00:56:00Z
23004120,ACCIDENTS - P.D. NOT REPORTABLE,12/9/2023 21:21,Closed - Non-Criminal Case,12/9/2023 21:21,NULL,300 N 17th St,2023-12-09T21:21:00Z
23004117,MEDICAL EMERGENCY,12/9/2023 01:21,Closed - Non-Criminal Case,12/9/2023 01:21,NULL,880 N 17th St,2023-12-09T01:21:00Z
23004115,UNL POLICY VIOLATION -OTHER,12/9/2023 00:34,Closed - Non-Criminal Case,NULL,NULL,1055 N 16th St,2023-12-09T00:34:00Z
23004112,TRAFFIC - SUSPENDED DRIVER,12/8/2023 23:54,Closed - Cleared by Arrest-Adult,12/8/2023 23:54,NULL,N 13TH ST & N ST,2023-12-08T23:54:00Z
23004108,DISTURBANCE - OTHER,12/8/2023 12:48,Closed - Non-Criminal Case,12/8/2023 12:48,NULL,1400 R St,2023-12-08T12:48:00Z
23004106,LOST OR STOLEN ITEM,12/8/2023 11:15,Closed - Inactive,11/23/2023 12:00,11/26/2023 15:00,NA,2023-12-08T11:15:00Z
23004103,TRESPASSING,12/8/2023 07:36,Closed - Inactive,12/8/2023 07:36,NULL,1625 Arbor Dr,2023-12-08T07:36:00Z
23004094,"PROPERTY DAMAGE - UNINTENTIONAL,NON TRAFFIC",12/7/2023 18:24,Closed - Non-Criminal Case,12/7/2023 13:50,12/7/2023 13:55,1410 Q St,2023-12-07T18:24:00Z
23004092,ACCIDENTS - P.D. NOT REPORTABLE,12/7/2023 16:32,Closed - Non-Criminal Case,12/4/2023 14:20,NULL,1111 N 14th St,2023-12-07T16:32:00Z
23004090,DISTURBANCE - OTHER,12/7/2023 14:39,Closed - Non-Criminal Case,12/7/2023 14:30,NULL,1300 R St,2023-12-07T14:39:00Z
23004078,TRAFFIC - SUSPENDED DRIVER,12/6/2023 16:59,Closed - Cleared by Arrest-Adult,12/6/2023 16:59,NULL,SALT CREEK RDWY & N ANTELOPE VALLEY PKWY,2023-12-06T16:59:00Z
23004079,ACCIDENTS - P.D. NOT REPORTABLE,12/6/2023 16:58,Closed - Non-Criminal Case,12/6/2023 16:22,NULL,600 N 17th St,2023-12-06T16:58:00Z
23004073,TRESPASSING,12/5/2023 22:55,Closed - Non-Criminal Case,12/5/2023 22:55,NULL,1400 R St,2023-12-05T22:55:00Z
23004061,TELEPHONE - OBSCENE CALLS,12/4/2023 18:30,Closed - Inactive,12/4/2023 17:45,NULL,1248 R St,2023-12-04T18:30:00Z
23004062,UNL POLICY VIOLATION -OTHER,12/4/2023 18:06,Closed - Non-Criminal Case,12/4/2023 18:06,NULL,1300 R St,2023-12-04T18:06:00Z
23004056,VANDALISM - OTHER,12/4/2023 16:01,Closed - Inactive,12/2/2023 06:00,12/2/2023 07:00,1801 R St,2023-12-04T16:01:00Z
23004057,ACCIDENTS - P.D. NOT REPORTABLE,12/4/2023 15:01,Closed - Non-Criminal Case,11/30/2023 10:10,NULL,1801 R St,2023-12-04T15:01:00Z
23004058,ACCIDENTS - P.D. H&R NOT REPORTABLE,12/4/2023 15:00,Closed - Inactive,12/4/2023 14:35,NULL,1505 S St,2023-12-04T15:00:00Z
23004055,LARCENY - FROM BUILDING,12/4/2023 14:51,Closed - Non-Criminal Case,12/4/2023 10:30,12/4/2023 11:00,550 N 19th St,2023-12-04T14:51:00Z
23004051,ACCIDENTS - P.D. H&R NOT REPORTABLE,12/4/2023 11:34,Closed - Inactive,11/26/2023 17:30,11/27/2023 13:40,300 N 17th St,2023-12-04T11:34:00Z
23004049,DISTURBANCE - OTHER,12/4/2023 08:40,Closed - Non-Criminal Case,12/4/2023 08:25,12/4/2023 08:40,560 Stadium Dr,2023-12-04T08:40:00Z
23004047,MEDICAL EMERGENCY,12/4/2023 06:11,Closed - Non-Criminal Case,12/4/2023 06:11,NULL,905 N 14th St,2023-12-04T06:11:00Z
23004035,MEDICAL EMERGENCY,12/2/2023 20:39,Closed - Non-Criminal Case,12/2/2023 20:39,NULL,1600 Court St,2023-12-02T20:39:00Z
23004036,VANDALISM - OTHER,12/2/2023 20:33,Closed - Inactive,12/1/2023 17:00,12/2/2023 16:30,3400 Starr Apt 1,2023-12-02T20:33:00Z
23004033,VANDALISM - OTHER,12/2/2023 15:28,Closed - Inactive,12/2/2023 14:05,NULL,3601 Apple St,2023-12-02T15:28:00Z
23004031,SEX OFFENSE - RAPE,12/2/2023 05:57,Closed - Inactive,12/1/2023 22:45,12/2/2023 05:30,1510 Vine St,2023-12-02T05:57:00Z
23004028,TRAFFIC - SUSPENDED DRIVER,12/2/2023 01:07,Closed - Cleared by Arrest-Adult,12/2/2023 01:07,NULL,N ANTELOPE VALLEY PKWY & S ST,2023-12-02T01:07:00Z
23004018,OUTSIDE - O.P.S. OTHER,12/1/2023 10:08,Closed - Non-Criminal Case,12/1/2023 10:08,NULL,550 N 19th St,2023-12-01T10:08:00Z
23004016,MEDICAL EMERGENCY,12/1/2023 02:43,Closed - Non-Criminal Case,11/30/2023 22:00,12/1/2023 02:43,820 N 17th St,2023-12-01T02:43:00Z
23004015,ALCOHOL - DWI,11/30/2023 23:41,Closed - Cleared by Arrest-Adult,11/30/2023 23:41,NULL,N 9TH ST,2023-11-30T23:41:00Z
23004013,OUTSIDE - O.P.S. OTHER,11/30/2023 22:33,Closed - Non-Criminal Case,11/30/2023 22:33,NULL,N 22ND ST & P ST,2023-11-30T22:33:00Z
23004011,DISTURBANCE - OTHER,11/30/2023 21:15,Closed - Inactive,11/30/2023 20:45,NULL,1300 R St,2023-11-30T21:15:00Z
23003995,NARCOTICS - OTHER,11/29/2023 22:19,Closed - Non-Criminal Case,11/29/2023 22:19,NULL,1780 R St,2023-11-29T22:19:00Z
23003994,NARCOTICS - OTHER,11/29/2023 20:11,Closed - Non-Criminal Case,11/29/2023 20:11,NULL,1801 R St,2023-11-29T20:11:00Z
23003991,FIRE (WORKING) - ALARM,11/29/2023 17:03,Closed - Non-Criminal Case,11/29/2023 17:03,NULL,1901 Vine St,2023-11-29T17:03:00Z
23003989,LARCENY - FROM BUILDING,11/29/2023 16:38,Closed - Inactive,11/24/2023 12:30,11/24/2023 16:00,1100 T St,2023-11-29T16:38:00Z
23003984,ALCOHOL - MINOR IN POSSESSION,11/29/2023 00:28,Closed - Cleared by Arrest-Adult,11/28/2023 22:30,11/28/2023 23:30,1130 N 14th St,2023-11-29T00:28:00Z
23003970,NARCOTICS - POSSESSION,11/27/2023 23:11,Closed - Cleared by Arrest-Adult,11/27/2023 23:11,NULL,1130 N 14th St,2023-11-27T23:11:00Z
OS23009,SEX OFFENSE - RAPE,11/27/2023 14:33,NA - Clery Report Only,9/1/2022 12:00,NULL,On Campus,2023-11-27T14:33:00Z
OS23008,ASSAULT - DOMESTIC,11/27/2023 14:29,NA - Clery Report Only,8/16/2023 12:00,NULL,Residence Hall,2023-11-27T14:29:00Z
OS23007,STALKING,11/27/2023 14:24,NA - Clery Report Only,6/23/2023 12:00,9/10/2023 11:00,Residence Hall and On campus,2023-11-27T14:24:00Z
OS23006,STALKING,11/27/2023 14:20,NA - Clery Report Only,9/13/2023 12:00,NULL,Residence Hall and On campus,2023-11-27T14:20:00Z
OS23005,STALKING,11/27/2023 14:16,NA - Clery Report Only,NULL,NULL,On-campus Building,2023-11-27T14:16:00Z
OS23004,STALKING,11/27/2023 14:11,NA - Clery Report Only,NULL,NULL,Residence Hall,2023-11-27T14:11:00Z
23003956,BURGLARY,11/26/2023 18:28,Closed - Inactive,11/17/2023 15:00,11/26/2023 18:15,880 N 17th St,2023-11-26T18:28:00Z
23003955,ALCOHOL - DWI,11/26/2023 02:21,Closed - Cleared by Arrest-Adult,11/26/2023 00:38,NULL,Q ST & N 11TH ST,2023-11-26T02:21:00Z
23003951,TRAFFIC - OTHER,11/25/2023 12:01,Closed - Inactive,11/25/2023 12:01,NULL,N 38TH ST & HUNTINGTON AVE,2023-11-25T12:01:00Z
23003945,ALCOHOL - DWI,11/25/2023 01:41,Closed - Cleared by Arrest-Adult,11/25/2023 01:41,NULL,N 14TH ST & Q ST,2023-11-25T01:41:00Z
23003944,DISTURBANCE - OTHER,11/25/2023 00:10,Closed - Inactive,11/25/2023 00:10,NULL,N 16TH ST & W ST,2023-11-25T00:10:00Z
23003934,VANDALISM - OTHER,11/23/2023 17:29,Closed - Inactive,11/22/2023 22:00,11/23/2023 17:00,2222 Vine St,2023-11-23T17:29:00Z
23003929,ASSAULT - NON DOMESTIC,11/22/2023 14:53,Closed - Inactive,11/21/2023 19:40,11/21/2023 19:50,1100 T St,2023-11-22T14:53:00Z
23003924,ALCOHOL - MINOR IN POSSESSION,11/21/2023 20:14,Closed - Cleared by Arrest-Juvenile,11/21/2023 20:14,NULL,1100 T St,2023-11-21T20:14:00Z
23003923,DISTURBANCE - OTHER,11/21/2023 19:15,Closed - Inactive,11/21/2023 19:15,NULL,501 N 14th St,2023-11-21T19:15:00Z
23003915,LOST OR STOLEN ITEM,11/21/2023 12:53,Closed - Non-Criminal Case,NULL,NULL,402 W. State Farm Road,2023-11-21T12:53:00Z
23003910,SS - CHECK WELFARE OF PERSON,11/21/2023 07:39,Closed - Non-Criminal Case,NULL,NULL,1780 R St,2023-11-21T07:39:00Z
23003906,UNL POLICY VIOLATION -OTHER,11/20/2023 23:05,Closed - Non-Criminal Case,11/20/2023 23:05,NULL,733 N 17th St,2023-11-20T23:05:00Z
23003901,ACCIDENTS - P.D. H&R NOT REPORTABLE,11/20/2023 15:38,Closed - Non-Criminal Case,11/20/2023 14:07,NULL,707 Stadium Dr,2023-11-20T15:38:00Z
23003894,TRESPASSING,11/20/2023 05:45,Closed - Non-Criminal Case,11/20/2023 05:45,NULL,1300 R St,2023-11-20T05:45:00Z
23003893,TRESPASSING,11/19/2023 20:43,Closed - Non-Criminal Case,11/19/2023 20:43,NULL,1801 R St,2023-11-19T20:43:00Z
23003891,SEX OFFENSE - ATTEMPT RAPE,11/19/2023 15:27,Closed - Inactive,11/18/2023 00:00,NULL,880 N 17th St,2023-11-19T15:27:00Z
23003890,LOST OR STOLEN ITEM,11/19/2023 13:57,Closed - Inactive,11/18/2023 08:22,11/19/2023 13:57,1120 N 14th St,2023-11-19T13:57:00Z
23003888,TRESPASSING,11/18/2023 23:59,Closed - Non-Criminal Case,11/18/2023 23:59,NULL,1400 R St,2023-11-18T23:59:00Z
23003887,ALCOHOL - MINOR IN POSSESSION,11/18/2023 23:46,Closed - Cleared by Arrest-Adult,11/18/2023 23:46,NULL,R ST & N 17TH ST,2023-11-18T23:46:00Z
23003885,TRESPASSING,11/18/2023 22:47,Closed - Non-Criminal Case,11/18/2023 22:47,NULL,One Memorial Stadium Drive,2023-11-18T22:47:00Z
23003875,ALCOHOL - MINOR IN POSSESSION,11/18/2023 01:32,Closed - Cleared by Arrest-Adult,11/18/2023 01:32,NULL,1150 N 14th St,2023-11-18T01:32:00Z
23003873,NARCOTICS - OTHER,11/18/2023 00:32,Closed - Cleared by Arrest-Adult,11/18/2023 00:32,NULL,1220 N 14th St,2023-11-18T00:32:00Z
23003871,ALCOHOL - MINOR IN POSSESSION,11/17/2023 23:01,Closed - Non-Criminal Case,11/17/2023 23:01,NULL,433 N 19th St,2023-11-17T23:01:00Z
23003860,VANDALISM - BY GRAFFITI,11/17/2023 15:51,Closed - Inactive,NULL,NULL,1248 R St,2023-11-17T15:51:00Z
23003853,VANDALISM - OTHER,11/17/2023 09:30,Closed - Inactive,11/16/2023 17:00,11/17/2023 07:20,942 N 22nd St,2023-11-17T09:30:00Z
23003850,TRAFFIC - SUSPENDED DRIVER,11/16/2023 23:59,Closed - Cleared by Arrest-Adult,11/16/2023 23:59,NULL,N 16TH ST & Q ST,2023-11-16T23:59:00Z
23003849,NARCOTICS - OTHER,11/16/2023 23:27,Closed - Cleared by Arrest-Adult,11/16/2023 23:27,NULL,615 N 19th St,2023-11-16T23:27:00Z
23003846,ACCIDENTS - P.D. H&R NOT REPORTABLE,11/16/2023 20:33,Closed - Inactive,11/15/2023 17:00,11/16/2023 20:00,1830 Vine St,2023-11-16T20:33:00Z
23003844,TRAFFIC - OTHER,11/16/2023 18:54,Closed - Cleared by Arrest-Adult,11/16/2023 18:40,11/16/2023 18:54,840 N 14th St,2023-11-16T18:54:00Z
23003841,VANDALISM - OTHER,11/16/2023 14:23,Closed - Inactive,NULL,NULL,1400 Court Street,2023-11-16T14:23:00Z
23003839,FRAUD - CON GAMES/DECEPTION/FALSE    PRETENSE/OTHER,11/16/2023 13:47,Closed - Inactive,11/14/2023 12:00,11/16/2023 13:30,300 N 17th St,2023-11-16T13:47:00Z
23003836,OUTSIDE - O.P.S. OTHER,11/16/2023 09:10,Closed - Inactive,11/16/2023 11:11,NULL,City of Lincoln,2023-11-16T09:10:00Z
23003832,NARCOTICS - OTHER,11/15/2023 23:52,Closed - Cleared by Arrest-Adult,11/15/2023 23:52,NULL,ANTELOPE VALLEY PARKWAY & VINE ST,2023-11-15T23:52:00Z
23003834,NARCOTICS - POSSESSION,11/15/2023 23:35,Closed - Cleared by Arrest-Adult,11/15/2023 23:35,NULL,Y ST & N 17TH ST,2023-11-15T23:35:00Z
23003827,MISC - OTHER,11/15/2023 18:00,Closed - Non-Criminal Case,11/15/2023 18:00,NULL,1120 N 14th St,2023-11-15T18:00:00Z
23003823,VANDALISM - BY GRAFFITI,11/15/2023 10:57,Closed - Inactive,11/14/2023 16:00,11/15/2023 09:30,1101 T St,2023-11-15T10:57:00Z
23003825,MISC - OTHER,11/15/2023 10:33,Closed - Non-Criminal Case,11/14/2023 08:30,11/15/2023 14:29,NA,2023-11-15T10:33:00Z
23003820,MISC - OTHER,11/15/2023 08:26,Closed - Non-Criminal Case,NULL,NULL,1625 Arbor Dr,2023-11-15T08:26:00Z
23003813,LARCENY - STOLEN BIKE,11/14/2023 17:57,Closed - Cleared by Arrest-Adult,11/14/2023 10:30,11/14/2023 17:50,1209 R St,2023-11-14T17:57:00Z
23003808,LARCENY - FROM BUILDING,11/14/2023 15:31,Closed - Inactive,11/14/2023 13:30,11/14/2023 15:00,841 N 14th St,2023-11-14T15:31:00Z
23003805,TELEPHONE - OTHER,11/14/2023 10:51,Closed - Non-Criminal Case,8/1/2023 08:00,11/13/2023 09:30,730 N 14th St,2023-11-14T10:51:00Z
23003804,LARCENY - OTHER OR FROM OPEN AREA,11/14/2023 09:50,Closed - Cleared by Arrest-Adult,11/14/2023 07:45,11/14/2023 09:15,1300 Q St,2023-11-14T09:50:00Z
23003803,TRAFFIC - SUSPENDED DRIVER,11/14/2023 09:26,Closed - Cleared by Arrest-Adult,11/14/2023 09:26,11/14/2023 09:33,EAST CAMPUS LOOP & DAIRY STORE DRIVE,2023-11-14T09:26:00Z
23003799,ALCOHOL - DWI,11/13/2023 23:39,Closed - Cleared by Arrest-Adult,11/13/2023 23:39,NULL,Q ST & N 17TH ST,2023-11-13T23:39:00Z
23003791,MEDICAL EMERGENCY,11/13/2023 14:57,Closed - Non-Criminal Case,11/13/2023 14:57,NULL,3940 Fair St,2023-11-13T14:57:00Z
23003790,NARCOTICS - OTHER,11/13/2023 14:21,Closed - Inactive,NULL,NULL,3520 East Campus Loop N,2023-11-13T14:21:00Z
23003789,DISTURBANCE - OTHER,11/13/2023 12:39,Closed - Inactive,11/9/2023 14:30,11/9/2023 14:45,1625 Arbor Dr,2023-11-13T12:39:00Z
23003787,UNL POLICY VIOLATION -OTHER,11/13/2023 11:23,Closed - Non-Criminal Case,11/13/2023 11:23,NULL,1400 R St,2023-11-13T11:23:00Z
23003783,LOST OR STOLEN ITEM,11/13/2023 09:04,Closed - Non-Criminal Case,NULL,NULL,300 N 17th St,2023-11-13T09:04:00Z
23003785,TRESPASSING,11/13/2023 09:00,Closed - Cleared by Arrest-Adult,NULL,NULL,900 N 16th St,2023-11-13T09:00:00Z
23003780,FALSE SECURITY ALARMS - OTHER,11/13/2023 00:29,Closed - Inactive,11/13/2023 00:29,NULL,1510 Vine St,2023-11-13T00:29:00Z
23003769,TRAFFIC - SUSPENDED DRIVER,11/12/2023 02:16,Closed - Cleared by Arrest-Adult,11/12/2023 02:16,NULL,VINE ST & N 17TH ST,2023-11-12T02:16:00Z
23003768,NARCOTICS - POSSESSION,11/12/2023 01:00,Closed - Non-Criminal Case,11/12/2023 01:00,NULL,1830 Vine St,2023-11-12T01:00:00Z
23003765,MEDICAL EMERGENCY,11/11/2023 23:38,Closed - Non-Criminal Case,11/11/2023 23:38,NULL,1400 R St,2023-11-11T23:38:00Z
23003757,DISTURBANCE - OTHER,11/11/2023 13:28,Closed - Non-Criminal Case,8/1/2023 00:00,NULL,880 N 17th St,2023-11-11T13:28:00Z
23003755,TRESPASSING,11/11/2023 13:09,Closed - Cleared by Arrest-Adult,11/11/2023 13:09,NULL,1100 T St,2023-11-11T13:09:00Z
23003756,VANDALISM - BY GRAFFITI,11/11/2023 13:08,Closed - Inactive,NULL,NULL,2225 W St,2023-11-11T13:08:00Z
23003754,OUTSIDE - O.P.S. OTHER,11/11/2023 12:30,Closed - Inactive,11/11/2023 12:30,NULL,1100 T St,2023-11-11T12:30:00Z
23003749,UNL POLICY VIOLATION -OTHER,11/11/2023 10:02,Closed - Non-Criminal Case,11/11/2023 10:02,NULL,1400 R St,2023-11-11T10:02:00Z
23003748,ALCOHOL - USING FALSE I.D.,11/11/2023 05:49,Closed - Cleared by Arrest-Adult,11/11/2023 05:49,NULL,440 N 17th St,2023-11-11T05:49:00Z
23003750,DISTURBANCE - OTHER,11/11/2023 03:26,Closed - Non-Criminal Case,11/10/2023 14:30,NULL,1400 R St,2023-11-11T03:26:00Z
23003747,DISTURBANCE - OTHER,11/11/2023 01:20,Closed - Non-Criminal Case,11/10/2023 16:00,11/10/2023 22:00,900 N 16th St,2023-11-11T01:20:00Z
23003744,NARCOTICS - OTHER,11/11/2023 00:31,Closed - Cleared by Arrest-Adult,11/11/2023 00:31,NULL,1220 N 14th St,2023-11-11T00:31:00Z
23003725,VANDALISM - BY GRAFFITI,11/9/2023 08:30,Closed - Inactive,11/7/2023 15:00,11/9/2023 08:00,1101 T St,2023-11-09T08:30:00Z
23003722,ALCOHOL - MINOR IN POSSESSION,11/9/2023 01:16,Closed - Non-Criminal Case,11/9/2023 01:18,NULL,1130 N 14th St,2023-11-09T01:16:00Z
23003711,DISTURBANCE - OTHER,11/8/2023 12:15,Closed - Non-Criminal Case,11/8/2023 12:15,NULL,1400 R St,2023-11-08T12:15:00Z
23003710,MEDICAL EMERGENCY,11/8/2023 10:26,Closed - Non-Criminal Case,11/8/2023 10:26,NULL,707 Stadium Dr,2023-11-08T10:26:00Z
23003706,ACCIDENTS - P.D. H&R NOT REPORTABLE,11/7/2023 17:54,Closed - Non-Criminal Case,11/5/2023 18:30,11/7/2023 17:54,615 N 19th St,2023-11-07T17:54:00Z
23003704,FIRE - FALSE ALARM,11/7/2023 16:53,Closed - Cleared by Arrest-Adult,11/7/2023 16:53,NULL,844 N 16th St,2023-11-07T16:53:00Z
23003703,ACCIDENTS - P.D. H&R NOT REPORTABLE,11/7/2023 16:28,Closed - Inactive,11/6/2023 07:00,11/6/2023 19:00,1111 N 14th St,2023-11-07T16:28:00Z
23003700,LARCENY - OTHER OR FROM OPEN AREA,11/7/2023 16:11,Closed - Cleared by Arrest-Adult,11/7/2023 14:00,11/7/2023 15:00,1300 R St,2023-11-07T16:11:00Z
23003696,LARCENY - FROM BUILDING,11/7/2023 10:36,Closed - Cleared by Arrest-Adult,11/6/2023 20:00,11/7/2023 09:00,1801 R St,2023-11-07T10:36:00Z
23003694,ACCIDENTS - P.D. H&R NOT REPORTABLE,11/7/2023 10:22,Closed - Cleared by Arrest-Adult,11/2/2023 19:30,11/5/2023 14:50,1801 R St,2023-11-07T10:22:00Z
23003695,OUTSIDE - O.P.S. OTHER,11/7/2023 10:15,Closed - Inactive,10/21/2023 16:45,10/21/2023 17:10,NA,2023-11-07T10:15:00Z
23003691,ALCOHOL - USING FALSE I.D.,11/7/2023 05:57,Closed - Cleared by Arrest-Adult,11/7/2023 05:57,NULL,512 N 12th St,2023-11-07T05:57:00Z
23003684,DISTURBANCE - OTHER,11/6/2023 20:08,Closed - Non-Criminal Case,10/13/2023 00:00,11/6/2023 00:00,1055 N 16th St,2023-11-06T20:08:00Z
23003682,OUTSIDE - O.P.S. OTHER,11/6/2023 19:08,Closed - Non-Criminal Case,NULL,NULL,1400 R St,2023-11-06T19:08:00Z
23003677,SEX OFFENSE - RAPE,11/6/2023 14:35,Closed - Inactive,12/21/2021 00:01,12/21/2021 23:59,1150 N 14th St,2023-11-06T14:35:00Z
23003669,EXTORTION,11/5/2023 21:55,Open,11/3/2023 20:58,11/5/2023 22:58,820 N 17th St,2023-11-05T21:55:00Z
23003666,ACCIDENTS - P.D. H&R NOT REPORTABLE,11/5/2023 17:30,Closed - Non-Criminal Case,11/2/2023 20:00,11/5/2023 11:00,1801 R St,2023-11-05T17:30:00Z
23003664,ACCIDENTS - P.D. H&R NOT REPORTABLE,11/5/2023 16:00,Closed - Non-Criminal Case,11/4/2023 16:00,11/5/2023 15:50,615 N 19th St,2023-11-05T16:00:00Z
23003663,LARCENY - STOLEN BIKE,11/5/2023 15:09,Closed - Inactive,11/3/2023 18:00,11/4/2023 08:00,1801 R St,2023-11-05T15:09:00Z
23003662,DISTURBANCE - OTHER,11/5/2023 10:46,Closed - Inactive,11/4/2023 21:15,11/4/2023 21:32,433 V St,2023-11-05T10:46:00Z
23003661,SUSPICIOUS PERSON,11/5/2023 02:00,Closed - Non-Criminal Case,11/5/2023 02:00,NULL,433 N 19th St,2023-11-05T02:00:00Z
23003657,ALCOHOL - UNL POLICY VIOLATION,11/5/2023 00:05,Closed - Inactive,11/5/2023 00:05,NULL,433 N 19th St,2023-11-05T00:05:00Z
23003658,OUTSIDE - O.P.S. OTHER,11/5/2023 00:04,Closed - Non-Criminal Case,11/5/2023 00:04,NULL,N 32ND ST & HOLDREGE ST,2023-11-05T00:04:00Z
23003654,LARCENY - OTHER OR FROM OPEN AREA,11/4/2023 21:22,Closed - Inactive,11/4/2023 11:00,NULL,880 N 16th St,2023-11-04T21:22:00Z
23003653,DISTURBANCE - OTHER,11/4/2023 19:11,Closed - Non-Criminal Case,11/4/2023 19:11,NULL,900 N 16th St,2023-11-04T19:11:00Z
23003652,SEX OFFENSE - INDECENT EXPOSURE,11/4/2023 17:44,Closed - Cleared by Arrest-Adult,11/4/2023 17:44,NULL,716 N 16th St,2023-11-04T17:44:00Z
23003644,MEDICAL EMERGENCY,11/3/2023 23:31,Closed - Non-Criminal Case,11/3/2023 23:31,NULL,1400 R St,2023-11-03T23:31:00Z
23003635,SS - CHECK WELFARE OF PERSON,11/3/2023 16:40,Closed - Non-Criminal Case,11/3/2023 16:40,NULL,1055 N 16th St,2023-11-03T16:40:00Z
23003632,VANDALISM - OTHER,11/3/2023 14:51,Closed - Non-Criminal Case,10/29/2023 19:00,11/3/2023 14:00,1801 R St,2023-11-03T14:51:00Z
23003631,LARCENY - FROM BUILDING,11/3/2023 11:30,Closed - Inactive,10/26/2023 23:37,10/27/2023 00:30,433 N 19th St,2023-11-03T11:30:00Z
23003629,OUTSIDE - O.P.S. OTHER,11/3/2023 08:23,Closed - Non-Criminal Case,10/31/2023 23:20,NULL,1209 New Hampshire St,2023-11-03T08:23:00Z
23003625,UNL POLICY VIOLATION -OTHER,11/2/2023 23:17,Closed - Non-Criminal Case,11/2/2023 21:00,NULL,900 N 16th St,2023-11-02T23:17:00Z
23003623,ACCIDENTS - P.D. H&R NOT REPORTABLE,11/2/2023 21:15,Closed - Non-Criminal Case,11/2/2023 21:15,NULL,4000 East Campus Loop S,2023-11-02T21:15:00Z
23003621,LARCENY - FROM BUILDING,11/2/2023 19:24,Closed - Inactive,11/2/2023 17:30,11/2/2023 19:15,639 N 12th St,2023-11-02T19:24:00Z
23003675,SS - CHECK WELFARE OF PERSON,11/2/2023 13:12,Closed - Non-Criminal Case,11/2/2023 12:00,11/2/2023 13:00,NA,2023-11-02T13:12:00Z
23003618,SUSPICIOUS PERSON,11/2/2023 11:03,Closed - Non-Criminal Case,11/2/2023 11:03,NULL,1710 Arbor Dr,2023-11-02T11:03:00Z
23003615,NARCOTICS - OTHER,11/1/2023 23:32,Closed - Non-Criminal Case,11/1/2023 23:32,NULL,1150 N 14th St,2023-11-01T23:32:00Z
23003614,NARCOTICS - POSSESSION,11/1/2023 22:33,Closed - Non-Criminal Case,11/1/2023 22:33,NULL,1120 N 14th St,2023-11-01T22:33:00Z
23003613,SEX OFFENSE - RAPE,11/1/2023 20:20,Closed - Inactive,11/1/2023 00:00,11/1/2023 01:00,1433 R St,2023-11-01T20:20:00Z
23003612,ACCIDENTS - P.D. H&R NOT REPORTABLE,11/1/2023 11:42,Closed - Inactive,10/30/2023 19:10,10/30/2023 21:30,1101 Salt Creek Rdwy,2023-11-01T11:42:00Z
23003603,DISTURBANCE - OTHER,10/31/2023 19:49,Closed - Inactive,10/31/2023 19:47,NULL,1400 R St,2023-10-31T19:49:00Z
23003601,DISTURBANCE - OTHER,10/31/2023 14:21,Closed - Non-Criminal Case,10/31/2023 10:30,NULL,639 N 12th St,2023-10-31T14:21:00Z
23003597,TRESPASSING,10/31/2023 09:57,Closed - Inactive,10/28/2023 13:00,10/28/2023 13:30,1104 R St,2023-10-31T09:57:00Z
23003596,SUSPICIOUS PERSON,10/31/2023 08:18,Closed - Non-Criminal Case,10/31/2023 08:10,10/31/2023 08:23,560 Stadium Dr,2023-10-31T08:18:00Z
23003594,LARCENY - FROM MOTOR VEHICLE,10/30/2023 21:34,Closed - Cleared by Arrest-Adult,10/30/2023 17:40,10/30/2023 19:00,1700 N 34th St,2023-10-30T21:34:00Z
23003592,SS - CHECK WELFARE OF PERSON,10/30/2023 19:27,Closed - Non-Criminal Case,10/30/2023 19:27,NULL,1130 N 14th St,2023-10-30T19:27:00Z
23003591,ACCIDENTS - P.D. NOT REPORTABLE,10/30/2023 18:30,Closed - Non-Criminal Case,10/23/2023 07:50,10/23/2023 08:00,615 N 19th St,2023-10-30T18:30:00Z
23003589,LARCENY - STOLEN BIKE,10/30/2023 17:15,Closed - Inactive,10/30/2023 08:20,10/30/2023 17:15,1901 Vine St,2023-10-30T17:15:00Z
23003588,DISTURBANCE - OTHER,10/30/2023 16:50,Closed - Inactive,10/30/2023 00:00,10/30/2023 16:50,1901 Vine St,2023-10-30T16:50:00Z
23003584,ACCIDENTS - P.D. NOT REPORTABLE,10/30/2023 11:48,Closed - Non-Criminal Case,NULL,NULL,1111 N 14th St,2023-10-30T11:48:00Z
23003580,ACCIDENTS - P.D. NOT REPORTABLE,10/30/2023 09:31,Closed - Non-Criminal Case,10/30/2023 09:31,NULL,615 N 19th St,2023-10-30T09:31:00Z
23003579,LARCENY - OTHER OR FROM OPEN AREA,10/30/2023 09:24,Closed - Non-Criminal Case,10/28/2023 15:00,10/30/2023 12:11,530 N 17th St,2023-10-30T09:24:00Z
23003577,"PROPERTY DAMAGE - UNINTENTIONAL,NON TRAFFIC",10/30/2023 07:45,Closed - Non-Criminal Case,10/30/2023 07:39,10/30/2023 07:45,512 N 12th St,2023-10-30T07:45:00Z
23003574,ASSAULT - DOMESTIC,10/29/2023 22:14,Closed - Cleared by Arrest-Adult,10/29/2023 22:14,NULL,433 N 19th St,2023-10-29T22:14:00Z
23003573,MEDICAL EMERGENCY,10/29/2023 21:24,Closed - Non-Criminal Case,10/29/2023 08:00,10/29/2023 21:24,300 N 17th St,2023-10-29T21:24:00Z
23003572,ACCIDENTS - P.D. NOT REPORTABLE,10/29/2023 21:15,Closed - Non-Criminal Case,10/29/2023 21:10,NULL,1777 N 42nd Street,2023-10-29T21:15:00Z
23003567,TRESPASSING,10/29/2023 08:19,Closed - Non-Criminal Case,10/29/2023 02:00,10/29/2023 08:19,600 N 15th St,2023-10-29T08:19:00Z
23003565,OUTSIDE - O.P.S. ACCIDENT,10/29/2023 02:20,Closed - Non-Criminal Case,10/29/2023 02:20,NULL,R ST & N 19TH ST,2023-10-29T02:20:00Z
23003564,DISTURBANCE - DOMESTIC,10/29/2023 00:13,Closed - Non-Criminal Case,10/29/2023 00:13,NULL,1120 N 14th St,2023-10-29T00:13:00Z
23003563,DISTURBANCE - OTHER,10/28/2023 19:56,Closed - Non-Criminal Case,10/28/2023 19:56,NULL,1400 R St,2023-10-28T19:56:00Z
23003562,ACCIDENTS - P.D. NOT REPORTABLE,10/28/2023 18:15,Closed - Non-Criminal Case,10/28/2023 18:15,NULL,1111 N 14th St,2023-10-28T18:15:00Z
23003570,DISTURBANCE - OTHER,10/28/2023 16:45,Closed - Non-Criminal Case,10/28/2023 16:45,10/28/2023 17:05,1100 T St,2023-10-28T16:45:00Z
23003559,OUTSIDE - O.P.S. OTHER,10/28/2023 15:58,Closed - Cleared by Arrest-Adult,10/28/2023 15:58,NULL,1100 T St,2023-10-28T15:58:00Z
23003558,"PROPERTY DAMAGE - UNINTENTIONAL,NON TRAFFIC",10/28/2023 15:34,Closed - Non-Criminal Case,NULL,NULL,N 14TH ST & VINE ST,2023-10-28T15:34:00Z
23003557,TRESPASSING,10/28/2023 12:22,Closed - Non-Criminal Case,10/28/2023 12:22,NULL,1400 R St,2023-10-28T12:22:00Z
23003549,SS - CHECK WELFARE OF PERSON,10/28/2023 01:52,Closed - Non-Criminal Case,10/28/2023 01:52,NULL,433 N 19th St,2023-10-28T01:52:00Z
23003547,ALCOHOL - MINOR IN POSSESSION,10/27/2023 23:06,Closed - Cleared by Arrest-Adult,10/27/2023 23:06,NULL,N 16TH ST & S ST,2023-10-27T23:06:00Z
23003542,ACCIDENTS - P.D. NOT REPORTABLE,10/27/2023 20:34,Closed - Non-Criminal Case,10/27/2023 20:34,NULL,1600 Court St,2023-10-27T20:34:00Z
23003536,TRESPASSING,10/27/2023 15:59,Closed - Non-Criminal Case,10/27/2023 15:59,NULL,313 N 13th St,2023-10-27T15:59:00Z
23003532,ACCIDENTS - P.D. H&R NOT REPORTABLE,10/27/2023 14:05,Closed - Inactive,10/27/2023 13:30,10/27/2023 14:00,1505 S St,2023-10-27T14:05:00Z
23003581,OUTSIDE - O.P.S. OTHER,10/27/2023 11:28,Closed - Non-Criminal Case,10/21/2023 18:00,NULL,129 N 10th St #100,2023-10-27T11:28:00Z
23003526,LARCENY - STOLEN BIKE,10/27/2023 10:36,Closed - Inactive,10/26/2023 19:00,10/27/2023 08:20,1780 R St,2023-10-27T10:36:00Z
23003524,ASSAULT - NON DOMESTIC,10/27/2023 09:41,Closed - Inactive,10/27/2023 00:45,10/27/2023 00:50,1433 R St,2023-10-27T09:41:00Z
23003523,LARCENY - OTHER OR FROM OPEN AREA,10/27/2023 09:33,Closed - Inactive,10/27/2023 01:22,NULL,733 N 17th St,2023-10-27T09:33:00Z
23003519,SUSPICIOUS PERSON,10/27/2023 07:13,Closed - Non-Criminal Case,10/27/2023 06:50,NULL,616 N 16th St,2023-10-27T07:13:00Z
23003518,ALCOHOL - DRUNK,10/27/2023 05:31,Closed - Non-Criminal Case,10/27/2023 05:31,NULL,1710 Arbor Dr,2023-10-27T05:31:00Z
23003515,ALCOHOL - MINOR IN POSSESSION,10/27/2023 01:51,Closed - Non-Criminal Case,10/27/2023 01:51,NULL,1120 N 14th St,2023-10-27T01:51:00Z
23003512,ALCOHOL - MINOR IN POSSESSION,10/26/2023 23:59,Closed - Non-Criminal Case,10/26/2023 23:59,NULL,433 N 19th St,2023-10-26T23:59:00Z
23003507,LARCENY - STOLEN BIKE,10/26/2023 19:14,Closed - Cleared by Arrest-Adult,10/26/2023 18:50,10/26/2023 19:10,501 N 14th St,2023-10-26T19:14:00Z
23003506,ACCIDENTS - P.D. H&R NOT REPORTABLE,10/26/2023 17:18,Closed - Inactive,NULL,NULL,1801 R St,2023-10-26T17:18:00Z
23003505,LARCENY - FROM BUILDING,10/26/2023 16:38,Closed - Cleared by Arrest-Adult,10/26/2023 15:07,NULL,1400 R St,2023-10-26T16:38:00Z
23003503,MEDICAL EMERGENCY,10/26/2023 14:26,Closed - Non-Criminal Case,10/26/2023 14:26,NULL,880 N 17th St,2023-10-26T14:26:00Z
23003494,SS - CHECK WELFARE OF PERSON,10/25/2023 19:53,Closed - Non-Criminal Case,10/25/2023 19:53,10/25/2023 19:53,1130 N 14th St,2023-10-25T19:53:00Z
23003491,DISTURBANCE - OTHER,10/25/2023 17:56,Closed - Non-Criminal Case,10/25/2023 17:45,NULL,1400 R St,2023-10-25T17:56:00Z
23003486,LOST OR STOLEN ITEM,10/25/2023 12:15,Closed - Inactive,10/23/2023 14:00,NULL,1100 T St,2023-10-25T12:15:00Z
23003484,LARCENY - FROM BUILDING,10/25/2023 10:18,Closed - Non-Criminal Case,10/24/2023 18:57,NULL,1100 T St,2023-10-25T10:18:00Z
23003475,ACCIDENTS - INJURY,10/24/2023 17:37,Closed - Non-Criminal Case,10/24/2023 17:37,NULL,745 N 14th St,2023-10-24T17:37:00Z
23003472,MISC - OTHER,10/24/2023 12:22,Closed - Non-Criminal Case,10/24/2023 12:22,NULL,845 N 14th St,2023-10-24T12:22:00Z
23003471,LARCENY - OTHER OR FROM OPEN AREA,10/24/2023 11:52,Closed - Inactive,10/7/2023 15:00,10/22/2023 19:00,1710 Arbor Dr,2023-10-24T11:52:00Z
23003465,DISTURBANCE - OTHER,10/23/2023 16:22,Closed - Non-Criminal Case,NULL,NULL,1780 R St,2023-10-23T16:22:00Z
23003464,DISTURBANCE - OTHER,10/23/2023 15:41,Closed - Non-Criminal Case,10/22/2023 03:00,NULL,1120 N 14th St,2023-10-23T15:41:00Z
23003461,ACCIDENTS - P.D. H&R NOT REPORTABLE,10/23/2023 14:53,Closed - Cleared by Arrest-Adult,10/23/2023 08:55,NULL,745 N 14th St,2023-10-23T14:53:00Z
23003460,ACCIDENTS - P.D. H&R NOT REPORTABLE,10/23/2023 13:44,Closed - Inactive,10/23/2023 09:06,10/23/2023 10:58,1111 N 14th St,2023-10-23T13:44:00Z
23003457,LARCENY - OTHER OR FROM OPEN AREA,10/23/2023 12:21,Closed - Cleared by Arrest-Adult,10/23/2023 10:45,10/23/2023 12:21,1248 R St,2023-10-23T12:21:00Z
23003458,DISTURBANCE - OTHER,10/23/2023 12:06,Closed - Non-Criminal Case,10/14/2023 19:48,10/21/2023 21:00,1600 Court St,2023-10-23T12:06:00Z
23003456,LARCENY - OTHER OR FROM OPEN AREA,10/23/2023 11:48,Closed - Non-Criminal Case,10/19/2023 08:00,NULL,4401 Fair St,2023-10-23T11:48:00Z
23003455,ACCIDENTS - P.D. H&R NOT REPORTABLE,10/23/2023 11:18,Closed - Inactive,10/21/2023 13:30,10/21/2023 17:30,200 Centennial Mall N,2023-10-23T11:18:00Z
23003447,NARCOTICS - OTHER,10/22/2023 01:30,Closed - Cleared by Arrest-Adult,10/22/2023 01:30,NULL,1111 N 14th St,2023-10-22T01:30:00Z
23003443,NARCOTICS - POSSESSION,10/21/2023 23:14,Closed - Cleared by Arrest-Adult,10/21/2023 23:14,NULL,880 N 17th St,2023-10-21T23:14:00Z
23003441,EXTORTION,10/21/2023 20:36,Closed - Inactive,10/21/2023 17:30,10/21/2023 19:39,880 N 17th St,2023-10-21T20:36:00Z
23003439,ACCIDENTS - P.D. H&R NOT REPORTABLE,10/21/2023 18:13,Closed - Inactive,10/21/2023 11:30,10/21/2023 17:00,900 N 21st St,2023-10-21T18:13:00Z
23003438,LARCENY - OTHER OR FROM OPEN AREA,10/21/2023 16:25,Closed - Inactive,10/21/2023 16:25,NULL,1100 T St,2023-10-21T16:25:00Z
23003433,DISTURBANCE - DOMESTIC,10/21/2023 02:07,Closed - Non-Criminal Case,10/21/2023 02:07,NULL,433 N 19th St,2023-10-21T02:07:00Z
23003431,ALCOHOL - MINOR IN POSSESSION,10/21/2023 00:41,Closed - Cleared by Arrest-Adult,10/21/2023 00:41,NULL,1400 R St,2023-10-21T00:41:00Z
23003424,VANDALISM - OTHER,10/20/2023 16:18,Closed - Inactive,8/18/2023 06:00,10/15/2023 21:00,880 N 17th St,2023-10-20T16:18:00Z
23003418,TRAFFIC - SUSPENDED DRIVER,10/20/2023 05:08,Closed - Cleared by Arrest-Adult,10/20/2023 05:08,NULL,DAIRY STORE DRIVE & HOLDREGE ST,2023-10-20T05:08:00Z
23003415,OUTSIDE - O.P.S. OTHER,10/20/2023 00:48,Closed - Non-Criminal Case,10/20/2023 00:48,NULL,N 12TH ST,2023-10-20T00:48:00Z
23003413,ALCOHOL - MINOR IN POSSESSION,10/19/2023 23:43,Closed - Non-Criminal Case,10/19/2023 23:43,NULL,880 N 17th St,2023-10-19T23:43:00Z
23003412,DISTURBANCE - OTHER,10/19/2023 23:30,Closed - Non-Criminal Case,10/19/2023 23:30,NULL,1400 R St,2023-10-19T23:30:00Z
23003411,ALCOHOL - MINOR IN POSSESSION,10/19/2023 23:11,Closed - Non-Criminal Case,10/19/2023 23:11,10/19/2023 23:29,880 N 17th St,2023-10-19T23:11:00Z
23003407,NARCOTICS - POSSESSION,10/19/2023 19:01,Closed - Non-Criminal Case,10/19/2023 19:01,NULL,880 N 17th St,2023-10-19T19:01:00Z
23003406,MEDICAL EMERGENCY,10/19/2023 18:15,Closed - Non-Criminal Case,10/19/2023 18:15,NULL,SALT CREEK RDWY & STADIUM DR,2023-10-19T18:15:00Z
23003405,MEDICAL EMERGENCY,10/19/2023 17:35,Closed - Non-Criminal Case,10/19/2023 17:35,NULL,1505 S St,2023-10-19T17:35:00Z
23003402,ACCIDENTS - P.D. H&R NOT REPORTABLE,10/19/2023 15:49,Closed - Cleared by Arrest-Adult,10/19/2023 12:17,NULL,745 N 14th St,2023-10-19T15:49:00Z
23003397,LARCENY - FROM BUILDING,10/19/2023 11:33,Closed - Inactive,9/1/2023 00:01,10/1/2023 23:59,1300 R St,2023-10-19T11:33:00Z
23003399,SUSPICIOUS PERSON,10/19/2023 11:09,Closed - Non-Criminal Case,10/19/2023 06:30,10/19/2023 06:45,733 N 17th St,2023-10-19T11:09:00Z
23003392,NARCOTICS - POSSESSION,10/19/2023 00:36,Closed - Cleared by Arrest-Adult,10/19/2023 00:36,NULL,Y ST & N 19TH ST,2023-10-19T00:36:00Z
23003385,LARCENY - STOLEN BIKE,10/18/2023 18:37,Closed - Cleared by Arrest-Adult,10/13/2023 09:00,10/18/2023 18:10,1801 R St,2023-10-18T18:37:00Z
23003384,LARCENY - OTHER OR FROM OPEN AREA,10/18/2023 17:02,Closed - Inactive,10/17/2023 17:00,10/18/2023 17:40,930 N 14th St,2023-10-18T17:02:00Z
23003373,SS - CHECK WELFARE OF PERSON,10/17/2023 13:36,Closed - Non-Criminal Case,NULL,NULL,900 N 16th St,2023-10-17T13:36:00Z
23003372,VANDALISM - BY GRAFFITI,10/17/2023 12:46,Closed - Inactive,NULL,NULL,1800 N 40th St,2023-10-17T12:46:00Z
23003371,FND ARTICLE OTHER THAN ABAND. BIKE OR VEH.,10/17/2023 12:13,Closed - Cleared by Arrest-Adult,NULL,NULL,1400 R St,2023-10-17T12:13:00Z
23003369,SUSPICIOUS PERSON,10/17/2023 05:43,Closed - Inactive,10/17/2023 05:43,NULL,1430 Vine St,2023-10-17T05:43:00Z
23003363,NARCOTICS - OTHER,10/16/2023 13:01,Closed - Cleared by Arrest-Adult,NULL,NULL,SALT CREEK RDWY & N 14TH ST,2023-10-16T13:01:00Z
23003359,ACCIDENTS - P.D. NOT REPORTABLE,10/15/2023 21:58,Closed - Non-Criminal Case,10/15/2023 19:00,NULL,1150 N 14th St,2023-10-15T21:58:00Z
23003356,TRESPASSING,10/15/2023 04:14,Closed - Non-Criminal Case,10/15/2023 04:14,10/15/2023 04:19,433 N 19th St,2023-10-15T04:14:00Z
23003355,NARCOTICS - POSSESSION,10/15/2023 02:15,Closed - Cleared by Arrest-Adult,10/15/2023 02:15,NULL,N 10TH ST & P ST,2023-10-15T02:15:00Z
23003354,TRAFFIC - SUSPENDED DRIVER,10/15/2023 01:56,Closed - Cleared by Arrest-Adult,10/15/2023 01:56,NULL,Q ST & N 13TH ST,2023-10-15T01:56:00Z
23003353,NARCOTICS - POSSESSION,10/14/2023 23:20,Closed - Cleared by Arrest-Adult,10/14/2023 23:20,NULL,N 12TH ST & R ST,2023-10-14T23:20:00Z
23003336,ACCIDENTS - P.D. H&R NOT REPORTABLE,10/13/2023 13:22,Closed - Inactive,10/8/2023 12:00,10/13/2023 13:00,1111 N 14th St,2023-10-13T13:22:00Z
23003331,SS - CHECK WELFARE OF PERSON,10/12/2023 23:59,Closed - Non-Criminal Case,10/12/2023 23:00,10/13/2023 01:20,880 N 17th St,2023-10-12T23:59:00Z
23003324,DISTURBANCE - OTHER,10/12/2023 14:58,Closed - Non-Criminal Case,10/3/2023 10:45,10/12/2023 11:09,625 Stadium Dr,2023-10-12T14:58:00Z
23003319,ACCIDENTS - P.D. NOT REPORTABLE,10/12/2023 12:40,Closed - Non-Criminal Case,10/12/2023 12:40,10/12/2023 12:40,1650 N 35th St,2023-10-12T12:40:00Z
23003320,LARCENY - STOLEN BIKE,10/12/2023 11:50,Closed - Inactive,10/12/2023 11:00,10/12/2023 11:30,402 Stadium Dr,2023-10-12T11:50:00Z
23003318,LARCENY - STOLEN BIKE,10/12/2023 10:33,Closed - Inactive,10/11/2023 20:00,10/12/2023 06:15,820 N 17th St,2023-10-12T10:33:00Z
23003313,NARCOTICS - POSSESSION,10/12/2023 01:45,Closed - Cleared by Arrest-Adult,10/12/2023 01:45,NULL,615 N 19th St,2023-10-12T01:45:00Z
23003312,ALCOHOL - MINOR IN POSSESSION,10/12/2023 01:24,Closed - Cleared by Arrest-Adult,10/12/2023 01:24,NULL,615 N 19th St,2023-10-12T01:24:00Z
23003311,TRESPASSING,10/12/2023 00:53,Closed - Cleared by Arrest-Adult,10/12/2023 00:53,NULL,1801 R St,2023-10-12T00:53:00Z
23003303,ACCIDENTS - P.D. H&R NOT REPORTABLE,10/11/2023 17:36,Closed - Inactive,10/10/2023 12:00,10/10/2023 17:15,4000 East Campus Loop S,2023-10-11T17:36:00Z
23003297,LARCENY - FROM BUILDING,10/11/2023 15:29,Closed - Inactive,6/8/2023 08:00,6/24/2023 12:00,880 N 17th St,2023-10-11T15:29:00Z
23003298,MEDICAL EMERGENCY,10/11/2023 15:29,Closed - Non-Criminal Case,10/11/2023 15:29,NULL,1400 R St,2023-10-11T15:29:00Z
23003295,DISTURBANCE - OTHER,10/11/2023 10:55,Closed - Non-Criminal Case,10/11/2023 10:40,NULL,501 N 14th St,2023-10-11T10:55:00Z
23003287,DISTURBANCE - OTHER,10/10/2023 18:35,Closed - Non-Criminal Case,10/10/2023 18:00,10/10/2023 18:30,480 N 16th St,2023-10-10T18:35:00Z
23003285,ACCIDENTS - P.D. H&R NOT REPORTABLE,10/10/2023 16:49,Closed - Non-Criminal Case,10/10/2023 13:00,10/10/2023 16:40,1111 N 14th St,2023-10-10T16:49:00Z
23003284,VANDALISM - OTHER,10/10/2023 15:16,Closed - Inactive,10/10/2023 13:40,10/10/2023 14:08,1000 N 16th St,2023-10-10T15:16:00Z
23003290,LARCENY - FROM BUILDING,10/10/2023 10:45,Closed - Non-Criminal Case,10/10/2023 10:00,10/10/2023 10:17,840 N 14th St,2023-10-10T10:45:00Z
23003270,VANDALISM - OTHER,10/9/2023 18:20,Closed - Inactive,10/2/2023 08:00,10/2/2023 17:00,1875 N 42nd St,2023-10-09T18:20:00Z
23003271,ACCIDENTS - P.D. H&R NOT REPORTABLE,10/9/2023 16:46,Closed - Inactive,10/6/2023 15:00,10/9/2023 16:15,1710 Arbor Dr,2023-10-09T16:46:00Z
23003264,DISTURBANCE - OTHER,10/9/2023 11:35,Closed - Inactive,10/6/2023 14:00,10/6/2023 14:30,512 N 12th St,2023-10-09T11:35:00Z
23003263,LARCENY - FROM BUILDING,10/9/2023 11:34,Closed - Inactive,9/22/2023 07:00,10/6/2023 12:00,540 N 16th St,2023-10-09T11:34:00Z
23003262,DISTURBANCE - OTHER,10/9/2023 10:45,Closed - Cleared by Arrest-Adult,10/9/2023 10:45,NULL,1410 Q St,2023-10-09T10:45:00Z
23003259,ACCIDENTS - P.D. H&R NOT REPORTABLE,10/8/2023 18:44,Closed - Inactive,10/5/2023 11:25,10/8/2023 18:44,4000 East Campus Loop S,2023-10-08T18:44:00Z
23003258,LARCENY - STOLEN BIKE,10/8/2023 18:28,Closed - Inactive,10/8/2023 04:56,NULL,733 N 17th St,2023-10-08T18:28:00Z
23003256,TRESPASSING,10/8/2023 12:55,Closed - Cleared by Arrest-Adult,NULL,NULL,440 N 17th St,2023-10-08T12:55:00Z
23003248,TRESPASSING,10/8/2023 01:10,Closed - Non-Criminal Case,10/8/2023 01:10,NULL,1400 R St,2023-10-08T01:10:00Z
23003247,DISTURBANCE - OTHER,10/7/2023 23:01,Closed - Non-Criminal Case,10/7/2023 22:50,10/7/2023 23:00,1055 N 16th St,2023-10-07T23:01:00Z
23003246,ALCOHOL - MINOR IN POSSESSION,10/7/2023 20:38,Closed - Non-Criminal Case,10/7/2023 20:15,10/7/2023 21:38,1880 Transformation Dr,2023-10-07T20:38:00Z
23003243,ACCIDENTS - P.D. H&R NOT REPORTABLE,10/7/2023 12:31,Closed - Inactive,10/5/2023 18:47,10/7/2023 10:00,1801 R St,2023-10-07T12:31:00Z
23003239,ALCOHOL - MINOR IN POSSESSION,10/7/2023 01:20,Closed - Non-Criminal Case,10/7/2023 01:20,NULL,880 N 17th St,2023-10-07T01:20:00Z
23003238,ALCOHOL - MINOR IN POSSESSION,10/7/2023 00:14,Closed - Cleared by Arrest-Adult,10/7/2023 00:14,NULL,820 N 17th St,2023-10-07T00:14:00Z
23003237,ACCIDENTS - P.D. H&R NOT REPORTABLE,10/6/2023 23:55,Closed - Non-Criminal Case,10/5/2023 23:00,10/6/2023 11:00,1801 R St,2023-10-06T23:55:00Z
23003236,ALCOHOL - USING FALSE I.D.,10/6/2023 23:24,Closed - Cleared by Arrest-Adult,10/6/2023 23:24,NULL,300 N 17th St,2023-10-06T23:24:00Z
23003234,MEDICAL EMERGENCY,10/6/2023 22:46,Closed - Non-Criminal Case,10/6/2023 22:45,10/6/2023 22:46,3601 Apple St,2023-10-06T22:46:00Z
23003231,MEDICAL EMERGENCY,10/6/2023 20:49,Closed - Non-Criminal Case,10/6/2023 19:30,10/6/2023 21:30,1055 N 16th St,2023-10-06T20:49:00Z
23003219,LARCENY - STOLEN BIKE,10/5/2023 22:05,Closed - Inactive,10/4/2023 22:52,NULL,820 N 17th St,2023-10-05T22:05:00Z
23003212,ACCIDENTS - P.D. NOT REPORTABLE,10/5/2023 17:01,Closed - Non-Criminal Case,10/5/2023 17:01,NULL,1111 N 14th St,2023-10-05T17:01:00Z
23003211,ACCIDENTS - P.D. H&R NOT REPORTABLE,10/5/2023 15:42,Closed - Inactive,10/4/2023 17:00,10/5/2023 08:10,855 N 16th St,2023-10-05T15:42:00Z
23003208,OUTSIDE - O.P.S. OTHER,10/5/2023 14:12,Closed - Non-Criminal Case,10/5/2023 14:12,NULL,ANTELOPE VALLEY PARKWAY & N 17TH ST,2023-10-05T14:12:00Z
23003203,TRESPASSING,10/5/2023 04:53,Closed - Cleared by Arrest-Adult,10/5/2023 04:53,NULL,1300 R St,2023-10-05T04:53:00Z
23003201,NARCOTICS - POSSESSION,10/5/2023 00:04,Closed - Cleared by Arrest-Adult,10/5/2023 00:04,NULL,1220 N 14th St,2023-10-05T00:04:00Z
23003198,VANDALISM - OTHER,10/4/2023 16:47,Closed - Inactive,10/4/2023 14:30,10/4/2023 16:30,4000 East Campus Loop S,2023-10-04T16:47:00Z
23003194,VANDALISM - OTHER,10/4/2023 09:22,Closed - Inactive,10/3/2023 11:30,10/3/2023 14:00,900 N 16th St,2023-10-04T09:22:00Z
23003193,"PROPERTY DAMAGE - UNINTENTIONAL,NON TRAFFIC",10/4/2023 09:01,Closed - Non-Criminal Case,9/27/2023 09:00,9/28/2023 15:30,1100 T St,2023-10-04T09:01:00Z
23003191,DISTURBANCE - OTHER,10/4/2023 08:09,Closed - Non-Criminal Case,9/30/2023 03:05,NULL,733 N 17th St,2023-10-04T08:09:00Z
23003185,LARCENY - OTHER OR FROM OPEN AREA,10/3/2023 17:55,Closed - Non-Criminal Case,10/30/2023 14:15,10/30/2023 15:30,1400 R St,2023-10-03T17:55:00Z
23003181,ACCIDENTS - P.D. NOT REPORTABLE,10/3/2023 14:22,Closed - Non-Criminal Case,10/3/2023 10:58,NULL,933 N 16th St,2023-10-03T14:22:00Z
23003178,UNL POLICY VIOLATION - WEAPONS,10/2/2023 23:07,Closed - Non-Criminal Case,10/2/2023 23:07,NULL,1120 N 14th St,2023-10-02T23:07:00Z
23003167,VANDALISM - OTHER,10/2/2023 16:09,Closed - Inactive,10/2/2023 12:20,10/2/2023 15:00,933 N 16th St,2023-10-02T16:09:00Z
23003163,ACCIDENTS - P.D. H&R NOT REPORTABLE,10/2/2023 11:59,Closed - Cleared by Arrest-Adult,9/30/2023 08:00,10/1/2023 15:00,1111 N 14th St,2023-10-02T11:59:00Z
23003162,MEDICAL EMERGENCY,10/2/2023 11:10,Closed - Non-Criminal Case,10/2/2023 11:00,10/2/2023 11:10,3550 East Campus Loop S,2023-10-02T11:10:00Z
23003159,ACCIDENTS - P.D. H&R NOT REPORTABLE,10/2/2023 07:07,Closed - Inactive,9/29/2023 06:30,9/29/2023 15:00,707 Stadium Dr,2023-10-02T07:07:00Z
23003156,SUSPICIOUS PERSON,10/2/2023 03:04,Closed - Inactive,10/2/2023 03:04,NULL,440 N 17th St,2023-10-02T03:04:00Z
23003154,MEDICAL EMERGENCY,10/1/2023 22:25,Closed - Non-Criminal Case,10/1/2023 22:25,NULL,1601 R St,2023-10-01T22:25:00Z
23003153,MEDICAL EMERGENCY,10/1/2023 21:09,Closed - Non-Criminal Case,10/1/2023 21:07,NULL,880 N 17th St,2023-10-01T21:09:00Z
23003149,NARCOTICS - POSSESSION,10/1/2023 11:59,Closed - Cleared by Arrest-Adult,10/1/2023 11:59,NULL,1100 T St,2023-10-01T11:59:00Z
23003148,ASSAULT - NON DOMESTIC,10/1/2023 11:23,Closed - Cleared by Arrest-Adult,10/1/2023 01:23,10/1/2023 01:35,635 N 16th St,2023-10-01T11:23:00Z
23003143,ALCOHOL - DWI,10/1/2023 02:04,Closed - Cleared by Arrest-Adult,10/1/2023 02:04,NULL,Q ST & N 16TH ST,2023-10-01T02:04:00Z
23003139,ALCOHOL - MINOR IN POSSESSION,9/30/2023 23:07,Closed - Cleared by Arrest-Adult,9/30/2021 23:07,NULL,1780 R St,2023-09-30T23:07:00Z
23003134,LARCENY - OTHER OR FROM OPEN AREA,9/30/2023 18:15,Closed - Non-Criminal Case,9/30/2023 13:30,9/30/2023 18:00,N 15TH ST & T ST,2023-09-30T18:15:00Z
23003130,LARCENY - OTHER OR FROM OPEN AREA,9/30/2023 17:13,Closed - Inactive,9/29/2023 12:00,9/30/2023 17:00,1400 R St,2023-09-30T17:13:00Z
23003124,ACCIDENTS - P.D. NOT REPORTABLE,9/30/2023 14:18,Closed - Non-Criminal Case,9/30/2023 14:18,NULL,841 N 14th St,2023-09-30T14:18:00Z
23003117,FIRE - FALSE ALARM,9/30/2023 03:39,Closed - Non-Criminal Case,9/30/2023 03:39,NULL,1545 R St,2023-09-30T03:39:00Z
23003113,ALCOHOL - MINOR IN POSSESSION,9/29/2023 23:44,Closed - Non-Criminal Case,9/29/2023 23:44,NULL,1535 R St,2023-09-29T23:44:00Z
23003111,ALCOHOL - USING FALSE I.D.,9/29/2023 23:08,Closed - Cleared by Arrest-Adult,9/29/2023 23:08,NULL,841 N 14th St,2023-09-29T23:08:00Z
23003110,DISTURBANCE - OTHER,9/29/2023 23:06,Closed - Cleared by Arrest-Adult,9/29/2023 23:06,NULL,1400 R St,2023-09-29T23:06:00Z
23003102,ACCIDENTS - P.D. H&R NOT REPORTABLE,9/29/2023 17:30,Closed - Non-Criminal Case,9/29/2023 07:45,9/29/2023 13:20,550 N 19th St,2023-09-29T17:30:00Z
23003098,ACCIDENTS - P.D. H&R NOT REPORTABLE,9/29/2023 14:38,Closed - Non-Criminal Case,9/28/2023 19:00,9/29/2023 10:00,1400 R St,2023-09-29T14:38:00Z
23003095,DISTURBANCE - OTHER,9/29/2023 09:10,Closed - Inactive,9/29/2023 00:30,NULL,1150 N 14th St,2023-09-29T09:10:00Z
23003085,MEDICAL EMERGENCY,9/28/2023 22:02,Closed - Non-Criminal Case,9/28/2023 22:02,NULL,1130 N 14th St,2023-09-28T22:02:00Z
23003082,VANDALISM - OTHER,9/28/2023 17:25,Closed - Inactive,9/28/2023 08:00,9/28/2023 17:00,1248 R St,2023-09-28T17:25:00Z
23003081,TELEPHONE - THREATENING CALLS,9/28/2023 17:14,Closed - Inactive,9/16/2023 08:00,NULL,1548 Vine St,2023-09-28T17:14:00Z
23003078,ACCIDENTS - P.D. NOT REPORTABLE,9/28/2023 13:24,Closed - Non-Criminal Case,9/28/2023 13:24,NULL,1830 Vine St,2023-09-28T13:24:00Z
23003076,TRESPASSING,9/28/2023 10:23,Closed - Inactive,9/28/2023 10:23,NULL,400 Line Drive Cir,2023-09-28T10:23:00Z
23003068,TRESPASSING,9/28/2023 01:13,Closed - Cleared by Arrest-Adult,9/28/2023 01:13,NULL,1830 Vine St,2023-09-28T01:13:00Z
23003064,LARCENY - OTHER OR FROM OPEN AREA,9/27/2023 21:56,Closed - Cleared by Arrest-Adult,9/27/2023 19:30,9/27/2023 19:57,820 N 17th St,2023-09-27T21:56:00Z
23003062,LARCENY - FROM BUILDING,9/27/2023 17:26,Closed - Cleared by Arrest-Adult,9/27/2023 16:00,9/27/2023 17:00,1400 R St,2023-09-27T17:26:00Z
23003058,TRESPASSING,9/27/2023 02:04,Closed - Cleared by Arrest-Adult,9/27/2023 02:04,NULL,600 N 15th St,2023-09-27T02:04:00Z
23003052,DISTURBANCE - OTHER,9/26/2023 18:40,Closed - Non-Criminal Case,9/26/2023 18:30,NULL,1400 R St,2023-09-26T18:40:00Z
23003047,LARCENY - STOLEN BIKE,9/26/2023 13:13,Closed - Cleared by Arrest-Adult,9/25/2023 23:00,9/26/2023 13:57,1300 R St,2023-09-26T13:13:00Z
23003044,"PROPERTY DAMAGE - UNINTENTIONAL,NON TRAFFIC",9/26/2023 11:10,Closed - Non-Criminal Case,9/20/2023 14:00,9/20/2023 15:00,T ST & STADIUM DR,2023-09-26T11:10:00Z
23003042,LARCENY - OTHER OR FROM OPEN AREA,9/26/2023 09:15,Closed - Inactive,9/26/2023 00:01,9/26/2023 07:45,1801 R St,2023-09-26T09:15:00Z
23003041,TRESPASSING,9/26/2023 04:10,Closed - Cleared by Arrest-Adult,9/26/2023 04:10,NULL,625 Stadium Dr,2023-09-26T04:10:00Z
23003029,LARCENY - FROM BUILDING,9/25/2023 11:25,Closed - Inactive,9/20/2023 13:00,9/22/2023 17:00,1520 R St,2023-09-25T11:25:00Z
23003026,LARCENY - OTHER OR FROM OPEN AREA,9/25/2023 04:06,Closed - Non-Criminal Case,9/25/2023 04:06,NULL,1130 N 14th St,2023-09-25T04:06:00Z
23003025,FRAUD - CON GAMES/DECEPTION/FALSE    PRETENSE/OTHER,9/25/2023 01:37,Closed - Inactive,9/24/2023 08:00,9/25/2023 00:30,300 N 17th St,2023-09-25T01:37:00Z
23003023,LARCENY - OTHER OR FROM OPEN AREA,9/24/2023 13:45,Closed - Inactive,9/19/2023 00:00,NULL,440 N 17th St,2023-09-24T13:45:00Z
23003022,ACCIDENTS - P.D. H&R NOT REPORTABLE,9/24/2023 12:54,Closed - Cleared by Arrest-Adult,9/21/2023 08:30,9/21/2023 10:30,1111 N 14th St,2023-09-24T12:54:00Z
23003019,ALCOHOL - MINOR IN POSSESSION,9/24/2023 02:08,Closed - Non-Criminal Case,9/24/2023 02:08,NULL,433 N 19th St,2023-09-24T02:08:00Z
23003017,TRESPASSING,9/24/2023 01:16,Closed - Non-Criminal Case,9/24/2023 01:16,NULL,1400 R St,2023-09-24T01:16:00Z
23003014,ALCOHOL - DRUNK,9/23/2023 22:33,Closed - Non-Criminal Case,9/23/2023 22:33,NULL,N 14TH ST & VINE ST,2023-09-23T22:33:00Z
23003010,OUTSIDE - O.P.S. OTHER,9/23/2023 17:00,Closed - Cleared by Arrest-Adult,9/23/2023 17:00,NULL,1100 T St,2023-09-23T17:00:00Z
23002999,ACCIDENTS - P.D. NOT REPORTABLE,9/22/2023 22:08,Closed - Non-Criminal Case,9/22/2023 22:08,NULL,820 N 17th St,2023-09-22T22:08:00Z
23002996,DISTURBANCE - OTHER,9/22/2023 15:54,Closed - Non-Criminal Case,9/22/2023 15:54,9/22/2023 15:54,512 N 12th St,2023-09-22T15:54:00Z
23002985,TRESPASSING,9/22/2023 08:16,Closed - Inactive,9/22/2023 08:10,NULL,402 Stadium Dr,2023-09-22T08:16:00Z
23002978,FRAUD - CON GAMES/DECEPTION/FALSE    PRETENSE/OTHER,9/21/2023 17:43,Closed - Inactive,9/19/2023 00:00,NULL,300 N 17th St,2023-09-21T17:43:00Z
23002975,ACCIDENTS - P.D. NOT REPORTABLE,9/21/2023 08:17,Closed - Non-Criminal Case,9/21/2023 07:47,NULL,1329 R Street,2023-09-21T08:17:00Z
23002972,LARCENY - FROM BUILDING,9/20/2023 18:59,Closed - Inactive,9/20/2023 14:20,9/20/2023 15:28,660 N 12th St,2023-09-20T18:59:00Z
23002966,LOST OR STOLEN ITEM,9/20/2023 14:26,Closed - Unfounded,9/19/2023 22:30,9/20/2023 09:30,880 N 17th St,2023-09-20T14:26:00Z
23002962,DISTURBANCE - OTHER,9/20/2023 14:05,Closed - Non-Criminal Case,5/15/2023 14:05,9/20/2023 14:05,1300 R St,2023-09-20T14:05:00Z
23002956,SUSPICIOUS PERSON,9/20/2023 03:18,Closed - Non-Criminal Case,9/20/2023 03:18,NULL,820 N 17th St,2023-09-20T03:18:00Z
23002950,FIRE (WORKING) - ALARM,9/19/2023 19:38,Closed - Non-Criminal Case,9/19/2023 16:44,NULL,1120 N 14th St,2023-09-19T19:38:00Z
23002944,TELEPHONE - OTHER,9/19/2023 11:29,Closed - Inactive,9/19/2023 11:22,NULL,4000 East Campus Loop S,2023-09-19T11:29:00Z
23002943,TELEPHONE - OTHER,9/19/2023 10:32,Closed - Non-Criminal Case,9/17/2023 12:00,9/19/2023 09:41,NA,2023-09-19T10:32:00Z
23002938,OUTSIDE - O.P.S. ACCIDENT,9/19/2023 00:04,Closed - Non-Criminal Case,9/19/2023 00:04,NULL,N 27TH ST & VINE ST,2023-09-19T00:04:00Z
23002933,FND ARTICLE OTHER THAN ABAND. BIKE OR VEH.,9/18/2023 19:12,Closed - Inactive,NULL,NULL,300 N 17th St,2023-09-18T19:12:00Z
23002930,LARCENY - STOLEN BIKE,9/18/2023 16:36,Closed - Cleared by Arrest-Adult,9/16/2023 11:30,9/17/2023 14:20,550 N 19th St,2023-09-18T16:36:00Z
23002929,LARCENY - OTHER OR FROM OPEN AREA,9/18/2023 16:13,Closed - Cleared by Arrest-Adult,9/18/2023 16:00,NULL,1505 S St,2023-09-18T16:13:00Z
23002928,ACCIDENTS - P.D. NOT REPORTABLE,9/18/2023 16:04,Closed - Non-Criminal Case,9/18/2023 08:30,9/18/2023 16:00,1055 N 16th St,2023-09-18T16:04:00Z
23002927,ACCIDENTS - P.D. NOT REPORTABLE,9/18/2023 14:24,Closed - Non-Criminal Case,9/18/2023 14:10,NULL,707 Stadium Dr,2023-09-18T14:24:00Z
23002922,DISTURBANCE - OTHER,9/18/2023 09:47,Closed - Non-Criminal Case,9/18/2023 09:47,NULL,501 N 14th St,2023-09-18T09:47:00Z
23002921,DISTURBANCE - OTHER,9/18/2023 09:14,Closed - Non-Criminal Case,9/17/2023 09:15,NULL,900 N 16th St,2023-09-18T09:14:00Z
23002920,VANDALISM - OTHER,9/18/2023 09:00,Closed - Inactive,9/15/2023 08:30,9/18/2023 08:00,400 Line Drive Cir,2023-09-18T09:00:00Z
23002919,ACCIDENTS - P.D. NOT REPORTABLE,9/18/2023 08:49,Closed - Non-Criminal Case,9/16/2023 16:45,NULL,1111 N 14th ST,2023-09-18T08:49:00Z
23002917,ACCIDENTS - P.D. H&R NOT REPORTABLE,9/18/2023 08:22,Closed - Cleared by Arrest-Adult,9/13/2023 07:30,9/15/2023 07:00,1000 N 16th St,2023-09-18T08:22:00Z
23002912,DISTURBANCE - OTHER,9/17/2023 23:47,Closed - Non-Criminal Case,9/1/2023 00:01,9/17/2023 23:00,300 N 17th St,2023-09-17T23:47:00Z
23002906,ACCIDENTS - P.D. H&R NOT REPORTABLE,9/17/2023 16:15,Closed - Cleared by Arrest-Adult,9/13/2023 19:00,9/17/2023 15:00,1801 R St,2023-09-17T16:15:00Z
23002903,DISTURBANCE - OTHER,9/17/2023 13:24,Closed - Cleared by Arrest-Adult,9/17/2023 13:24,9/17/2023 13:24,1400 R St,2023-09-17T13:24:00Z
23002900,LARCENY - OTHER OR FROM OPEN AREA,9/17/2023 11:15,Closed - Non-Criminal Case,9/13/2023 19:00,9/13/2023 20:30,1700 N 34th St,2023-09-17T11:15:00Z
23002901,MISC - OTHER,9/17/2023 10:40,Closed - Inactive,9/17/2023 10:40,NULL,7001 W Fletcher Ave,2023-09-17T10:40:00Z
23002895,ALCOHOL - MINOR IN POSSESSION,9/16/2023 23:09,Closed - Non-Criminal Case,9/6/2023 23:09,NULL,880 N 17th St,2023-09-16T23:09:00Z
23002893,ACCIDENTS - P.D. NOT REPORTABLE,9/16/2023 22:40,Closed - Non-Criminal Case,9/16/2023 18:00,9/16/2023 22:40,1111 N 14th St,2023-09-16T22:40:00Z
23002889,NARCOTICS - OTHER,9/16/2023 21:51,Closed - Non-Criminal Case,9/16/2023 21:51,NULL,820 N 17th St,2023-09-16T21:51:00Z
23002883,ALCOHOL - MINOR IN POSSESSION,9/16/2023 18:59,Closed - Non-Criminal Case,9/16/2023 18:59,NULL,1100 T St,2023-09-16T18:59:00Z
23002881,ALCOHOL - MINOR IN POSSESSION,9/16/2023 18:28,Closed - Cleared by Arrest-Adult,9/16/2023 18:28,NULL,1100 T St,2023-09-16T18:28:00Z
23002880,ALCOHOL - MINOR IN POSSESSION,9/16/2023 18:06,Closed - Cleared by Arrest-Adult,9/16/2023 18:06,NULL,1100 T St,2023-09-16T18:06:00Z
23002878,ACCIDENTS - P.D. H&R NOT REPORTABLE,9/16/2023 12:06,Closed - Non-Criminal Case,9/15/2023 09:00,9/15/2023 16:30,1830 Vine St,2023-09-16T12:06:00Z
23002874,NARCOTICS - POSSESSION,9/16/2023 00:17,Closed - Cleared by Arrest-Adult,9/16/2023 00:17,NULL,615 N 19th St,2023-09-16T00:17:00Z
23002872,ALCOHOL - MINOR IN POSSESSION,9/15/2023 22:51,Closed - Non-Criminal Case,9/15/2023 22:51,NULL,1150 N 14th St,2023-09-15T22:51:00Z
23002918,DISTURBANCE - OTHER,9/15/2023 20:36,Closed - Cleared by Arrest-Adult,9/15/2023 19:48,9/18/2023 08:29,3835 Holdrege St,2023-09-15T20:36:00Z
23002864,ACCIDENTS - P.D. H&R NOT REPORTABLE,9/15/2023 17:10,Closed - Inactive,9/15/2023 14:45,9/15/2023 17:50,880 N 17th St,2023-09-15T17:10:00Z
23002859,ACCIDENTS - P.D. H&R NOT REPORTABLE,9/15/2023 11:27,Closed - Inactive,9/4/2023 00:01,9/14/2023 18:00,1801 R St,2023-09-15T11:27:00Z
23002857,DISTURBANCE - OTHER,9/15/2023 09:31,Closed - Non-Criminal Case,9/15/2023 01:00,9/15/2023 03:00,433 N 19th St,2023-09-15T09:31:00Z
23002853,LOST OR STOLEN ITEM,9/15/2023 02:04,Closed - Non-Criminal Case,9/14/2023 19:00,9/14/2023 21:00,300 N 17th St,2023-09-15T02:04:00Z
23002850,ALCOHOL - MINOR IN POSSESSION,9/15/2023 00:17,Closed - Non-Criminal Case,9/15/2023 00:17,NULL,880 N 17th St,2023-09-15T00:17:00Z
23002845,MEDICAL EMERGENCY,9/14/2023 16:23,Closed - Non-Criminal Case,9/14/2023 16:23,NULL,N 16TH ST & X ST,2023-09-14T16:23:00Z
23002843,VANDALISM - OTHER,9/14/2023 14:59,Closed - Inactive,9/9/2023 17:00,9/14/2023 13:00,3310 Holdrege St,2023-09-14T14:59:00Z
23002841,DISTURBANCE - OTHER,9/14/2023 12:43,Closed - Non-Criminal Case,9/14/2023 12:43,9/14/2023 12:43,1400 R St,2023-09-14T12:43:00Z
23002838,TRESPASSING,9/14/2023 01:38,Closed - Non-Criminal Case,9/14/2023 01:38,NULL,1209 R St,2023-09-14T01:38:00Z
23002834,TRESPASSING,9/13/2023 22:03,Closed - Cleared by Arrest-Adult,9/13/2023 22:03,NULL,1801 R St,2023-09-13T22:03:00Z
23002833,LARCENY - MOTOR VEH. ACCESSORIES,9/13/2023 19:04,Closed - Inactive,9/10/2023 01:24,NULL,1710 Arbor Dr,2023-09-13T19:04:00Z
23002830,LOST OR STOLEN ITEM,9/13/2023 16:07,Closed - Inactive,7/23/2023 08:00,8/29/2023 17:00,1150 N 14th St,2023-09-13T16:07:00Z
23002829,DISTURBANCE - OTHER,9/13/2023 15:33,Closed - Non-Criminal Case,9/13/2023 15:33,NULL,1150 N 14th St,2023-09-13T15:33:00Z
23002828,"PROPERTY DAMAGE - UNINTENTIONAL,NON TRAFFIC",9/13/2023 09:57,Closed - Non-Criminal Case,9/5/2023 11:40,NULL,1625 Arbor Dr,2023-09-13T09:57:00Z
23002823,DISTURBANCE - OTHER,9/12/2023 21:30,Closed - Inactive,9/5/2023 20:00,NULL,1130 N 14th St,2023-09-12T21:30:00Z
23002820,ACCIDENTS - P.D. H&R NOT REPORTABLE,9/12/2023 19:53,Closed - Inactive,9/11/2023 21:30,9/12/2023 19:53,615 N 19th St,2023-09-12T19:53:00Z
23002803,ACCIDENTS - P.D. H&R NOT REPORTABLE,9/11/2023 14:49,Closed - Cleared by Arrest-Adult,9/11/2023 14:28,NULL,4000 East Campus Loop S,2023-09-11T14:49:00Z
23002804,SS - CHECK WELFARE OF PERSON,9/11/2023 14:49,Closed - Non-Criminal Case,9/11/2023 14:49,NULL,1209 R St,2023-09-11T14:49:00Z
23002796,BURGLARY,9/10/2023 19:23,Closed - Cleared by Arrest-Adult,9/8/2023 10:00,9/10/2023 11:20,1901 Y St,2023-09-10T19:23:00Z
23002795,EXTORTION,9/10/2023 16:57,Closed - Inactive,9/10/2023 15:30,9/10/2023 16:30,1710 Arbor Dr,2023-09-10T16:57:00Z
23002793,SS - CHECK WELFARE OF PERSON,9/9/2023 22:43,Closed - Non-Criminal Case,9/9/2023 22:43,NULL,880 N 17th St,2023-09-09T22:43:00Z
23002788,TELEPHONE - THREATENING CALLS,9/9/2023 15:37,Closed - Non-Criminal Case,9/9/2023 14:36,NULL,300 N 17th St,2023-09-09T15:37:00Z
23002782,DISTURBANCE - OTHER,9/9/2023 00:52,Closed - Non-Criminal Case,9/9/2023 00:52,NULL,1780 R St,2023-09-09T00:52:00Z
23002781,VANDALISM - OTHER,9/8/2023 22:56,Closed - Inactive,9/8/2023 22:27,NULL,3601 Apple St,2023-09-08T22:56:00Z
23002780,MEDICAL EMERGENCY,9/8/2023 21:49,Closed - Non-Criminal Case,9/8/2023 21:49,NULL,1140 N 14th St,2023-09-08T21:49:00Z
23002779,VANDALISM - OTHER,9/8/2023 21:10,Closed - Cleared by Arrest-Adult,9/8/2023 21:10,NULL,880 N 17th St,2023-09-08T21:10:00Z
23002774,ACCIDENTS - P.D. H&R NOT REPORTABLE,9/8/2023 15:56,Closed - Inactive,9/8/2023 12:35,9/8/2023 15:10,1870 N 37th St,2023-09-08T15:56:00Z
23002776,SEX OFFENSE - RAPE,9/8/2023 15:00,Closed - Inactive,10/27/2022 16:00,NULL,440 N 17th St,2023-09-08T15:00:00Z
23002770,TRESPASSING,9/8/2023 04:42,Closed - Non-Criminal Case,9/8/2023 04:40,NULL,1400 R St,2023-09-08T04:42:00Z
23002769,ALCOHOL - USING FALSE I.D.,9/8/2023 01:52,Closed - Cleared by Arrest-Adult,9/8/2023 01:52,NULL,R ST & N 14TH ST,2023-09-08T01:52:00Z
23002768,ALCOHOL - MINOR IN POSSESSION,9/8/2023 01:15,Closed - Non-Criminal Case,9/8/2023 01:15,NULL,880 N 17th St,2023-09-08T01:15:00Z
23002767,ALCOHOL - MINOR IN POSSESSION,9/8/2023 01:04,Closed - Non-Criminal Case,9/8/2023 01:04,NULL,440 N 17th St,2023-09-08T01:04:00Z
23002765,NARCOTICS - POSSESSION,9/7/2023 22:52,Closed - Cleared by Arrest-Adult,9/7/2023 22:52,NULL,615 N 19th St,2023-09-07T22:52:00Z
23002763,DISTURBANCE - OTHER,9/7/2023 20:03,Closed - Non-Criminal Case,9/7/2023 20:03,NULL,1705 Arbor Dr,2023-09-07T20:03:00Z
23002761,LARCENY - FROM BUILDING,9/7/2023 16:12,Closed - Inactive,9/7/2023 12:00,9/7/2023 13:00,840 N 14th St,2023-09-07T16:12:00Z
23002760,ACCIDENTS - P.D. H&R NOT REPORTABLE,9/7/2023 15:55,Closed - Cleared by Arrest-Adult,9/7/2023 09:00,9/7/2023 15:25,1875 N 42nd St,2023-09-07T15:55:00Z
23002758,LARCENY - FROM BUILDING,9/7/2023 13:44,Closed - Inactive,9/7/2023 12:30,9/7/2023 13:28,501 N 14th St,2023-09-07T13:44:00Z
23002759,FRAUD - CREDIT CARDS/ATM/BANK CARD,9/7/2023 13:44,Closed - Inactive,9/7/2023 13:28,NULL,NA,2023-09-07T13:44:00Z
23002762,FRAUD - CREDIT CARDS/ATM/BANK CARD,9/7/2023 12:50,Closed - Inactive,9/7/2023 12:50,NULL,NA,2023-09-07T12:50:00Z
23002756,DISTURBANCE - OTHER,9/7/2023 11:35,Closed - Inactive,9/7/2023 11:35,NULL,820 N 16th St,2023-09-07T11:35:00Z
23002751,AUTO THEFT,9/7/2023 06:10,Closed - Inactive,9/6/2023 20:30,9/7/2023 06:00,2255 Vine St,2023-09-07T06:10:00Z
23002743,AUTO THEFT,9/6/2023 21:40,Closed - Cleared by Arrest-Adult,9/6/2023 17:28,NULL,707 Stadium Dr,2023-09-06T21:40:00Z
23002739,ACCIDENTS - P.D. NOT REPORTABLE,9/6/2023 09:53,Closed - Non-Criminal Case,9/6/2023 09:53,NULL,1111 Salt Creek Rdwy,2023-09-06T09:53:00Z
23002738,ACCIDENTS - P.D. H&R NOT REPORTABLE,9/6/2023 09:10,Closed - Cleared by Arrest-Adult,9/6/2023 08:07,NULL,1055 N 16th St,2023-09-06T09:10:00Z
23002730,ACCIDENTS - P.D. H&R NOT REPORTABLE,9/5/2023 16:45,Closed - Inactive,9/5/2023 15:00,9/5/2023 16:30,745 N 14th St,2023-09-05T16:45:00Z
23002728,SEX OFFENSE - RAPE,9/5/2023 15:48,Closed - Inactive,8/28/2023 00:00,NULL,433 N 19th St,2023-09-05T15:48:00Z
23002727,DISTURBANCE - OTHER,9/5/2023 14:27,Closed - Non-Criminal Case,9/5/2023 14:24,NULL,1335 U St,2023-09-05T14:27:00Z
23002725,ALCOHOL - USING FALSE I.D.,9/5/2023 12:37,Closed - Cleared by Arrest-Adult,9/5/2023 12:37,NULL,300 N 17th St,2023-09-05T12:37:00Z
23002723,TRESPASSING,9/5/2023 02:09,Closed - Inactive,9/5/2023 02:09,NULL,1400 R St,2023-09-05T02:09:00Z
23002720,TRESPASSING,9/4/2023 17:26,Closed - Non-Criminal Case,9/4/2023 17:26,NULL,1520 R St,2023-09-04T17:26:00Z
23002718,TRESPASSING,9/4/2023 12:09,Closed - Non-Criminal Case,9/4/2023 12:00,9/4/2023 12:09,1100 T St,2023-09-04T12:09:00Z
23002717,VANDALISM - OTHER,9/4/2023 11:14,Closed - Inactive,9/3/2023 21:30,9/4/2023 08:30,1220 N 14th St,2023-09-04T11:14:00Z
23002714,SS - CHECK WELFARE OF PERSON,9/3/2023 20:13,Closed - Non-Criminal Case,9/3/2023 20:13,NULL,1400 R St,2023-09-03T20:13:00Z
23002707,ALCOHOL - MINOR IN POSSESSION,9/2/2023 23:07,Closed - Non-Criminal Case,9/2/2023 23:07,NULL,1150 N 14th St,2023-09-02T23:07:00Z
23002705,VANDALISM - OTHER,9/2/2023 17:11,Closed - Non-Criminal Case,9/2/2023 01:30,9/2/2023 16:49,880 N 17th St,2023-09-02T17:11:00Z
23002697,ALCOHOL - DWI,9/2/2023 00:35,Closed - Cleared by Arrest-Adult,9/2/2023 00:35,NULL,N 16TH ST & R ST,2023-09-02T00:35:00Z
23002694,ALCOHOL - MINOR IN POSSESSION,9/1/2023 22:50,Closed - Non-Criminal Case,9/1/2023 22:40,9/1/2023 22:47,600 N 15th St,2023-09-01T22:50:00Z
23002692,DISTURBANCE - OTHER,9/1/2023 18:52,Open,9/1/2023 17:30,NULL,1600 Court St,2023-09-01T18:52:00Z
23002678,DISTURBANCE - OTHER,8/31/2023 14:00,Closed - Non-Criminal Case,8/24/2023 12:00,8/31/2023 14:00,4000 East Campus Loop S,2023-08-31T14:00:00Z
23002674,LARCENY - STOLEN BIKE,8/31/2023 11:15,Closed - Inactive,8/30/2023 13:00,8/30/2023 17:00,1875 N 42nd St,2023-08-31T11:15:00Z
23002673,LARCENY - FROM BUILDING,8/31/2023 10:25,Closed - Inactive,8/30/2023 15:45,8/30/2023 22:15,1100 T St,2023-08-31T10:25:00Z
23002659,VANDALISM - OTHER,8/30/2023 23:30,Closed - Non-Criminal Case,8/30/2023 23:26,8/30/2023 23:30,3835 Holdrege St,2023-08-30T23:30:00Z
23002663,LARCENY - OTHER OR FROM OPEN AREA,8/30/2023 21:31,Closed - Inactive,8/30/2023 14:00,NULL,733 N 17th St,2023-08-30T21:31:00Z
23002658,ALCOHOL - MINOR IN POSSESSION,8/30/2023 20:40,Closed - Cleared by Arrest-Adult,8/30/2023 20:40,NULL,1100 T St,2023-08-30T20:40:00Z
23002652,ACCIDENTS - P.D. H&R NOT REPORTABLE,8/30/2023 15:57,Closed - Non-Criminal Case,8/30/2023 15:57,NULL,1111 N 14th St,2023-08-30T15:57:00Z
23002649,ACCIDENTS - P.D. H&R NOT REPORTABLE,8/30/2023 14:49,Closed - Inactive,8/30/2023 13:45,8/30/2023 14:45,1700 N 34th St,2023-08-30T14:49:00Z
23002642,EXTORTION,8/30/2023 02:55,Closed - Inactive,8/30/2023 02:55,NULL,820 N 17th St,2023-08-30T02:55:00Z
23002641,DISTURBANCE - OTHER,8/30/2023 01:20,Closed - Non-Criminal Case,8/30/2023 01:20,NULL,1130 N 14th St,2023-08-30T01:20:00Z
23002634,ACCIDENTS - P.D. H&R NOT REPORTABLE,8/29/2023 15:28,Closed - Inactive,8/23/2023 11:00,8/23/2023 13:45,N 14TH ST & AVERY AVE,2023-08-29T15:28:00Z
23002632,TRAFFIC - OTHER,8/29/2023 12:21,Closed - Inactive,8/29/2023 12:20,8/29/2023 12:21,N 16TH ST & VINE ST,2023-08-29T12:21:00Z
23002630,TELEPHONE - OTHER,8/29/2023 09:49,Closed - Inactive,8/24/2023 08:00,8/24/2023 17:00,300 N 17th St,2023-08-29T09:49:00Z
23002629,"PROPERTY DAMAGE - UNINTENTIONAL,NON TRAFFIC",8/29/2023 09:01,Closed - Non-Criminal Case,8/29/2023 09:01,NULL,1600 Court St,2023-08-29T09:01:00Z
23002626,ALCOHOL - USING FALSE I.D.,8/28/2023 23:11,Closed - Cleared by Arrest-Adult,8/28/2023 23:11,NULL,300 N 17th St,2023-08-28T23:11:00Z
23002621,DISTURBANCE - OTHER,8/28/2023 15:43,Closed - Non-Criminal Case,8/22/2023 13:20,8/22/2023 14:00,1101 T St,2023-08-28T15:43:00Z
23002619,DISTURBANCE - OTHER,8/28/2023 14:01,Closed - Non-Criminal Case,8/28/2023 14:01,NULL,639 N 12th St,2023-08-28T14:01:00Z
23002617,VANDALISM - OTHER,8/28/2023 11:49,Closed - Inactive,NULL,NULL,3835 Holdrege St,2023-08-28T11:49:00Z
23002613,LARCENY - OTHER OR FROM OPEN AREA,8/27/2023 19:18,Closed - Inactive,8/27/2023 18:52,NULL,1505 S St,2023-08-27T19:18:00Z
23002611,"HAZARDS - NON-TRAFFIC (WIRES,TREES,ETC)",8/27/2023 13:47,Closed - Non-Criminal Case,8/27/2023 13:47,NULL,707 Stadium Dr,2023-08-27T13:47:00Z
23002609,VANDALISM - OTHER,8/27/2023 13:30,Closed - Inactive,8/27/2023 11:00,8/27/2023 13:00,841 N 14th St,2023-08-27T13:30:00Z
23002610,LARCENY - FROM BUILDING,8/27/2023 13:25,Closed - Inactive,8/27/2023 11:30,8/27/2023 13:00,841 N 14th St,2023-08-27T13:25:00Z
23002604,DISTURBANCE - OTHER,8/27/2023 02:51,Closed - Non-Criminal Case,8/27/2023 02:45,8/27/2023 02:50,440 N 17th St,2023-08-27T02:51:00Z
23002603,ALCOHOL - MINOR IN POSSESSION,8/27/2023 02:10,Closed - Non-Criminal Case,8/27/2023 02:10,NULL,880 N 17th St,2023-08-27T02:10:00Z
23002600,ASSAULT - NON DOMESTIC,8/27/2023 00:05,Closed - Cleared by Arrest-Juvenile,8/26/2023 23:16,NULL,733 N 17th St,2023-08-27T00:05:00Z
23002597,ALCOHOL - MINOR IN POSSESSION,8/26/2023 20:38,Closed - Non-Criminal Case,8/26/2023 20:38,NULL,880 N 17th St,2023-08-26T20:38:00Z
23002592,LARCENY - OTHER OR FROM OPEN AREA,8/26/2023 12:42,Closed - Cleared by Arrest-Adult,8/26/2023 11:08,NULL,841 N 14th St,2023-08-26T12:42:00Z
23002590,FRAUD - CON GAMES/DECEPTION/FALSE    PRETENSE/OTHER,8/26/2023 10:03,Closed - Inactive,8/25/2023 17:00,8/25/2023 19:30,880 N 17th St,2023-08-26T10:03:00Z
23002586,ALCOHOL - MINOR IN POSSESSION,8/26/2023 00:38,Closed - Non-Criminal Case,8/26/2023 00:38,NULL,880 N 17th St,2023-08-26T00:38:00Z
23002582,ALCOHOL - MINOR IN POSSESSION,8/25/2023 23:35,Closed - Cleared by Arrest-Adult,8/25/2023 23:35,NULL,880 N 17th St,2023-08-25T23:35:00Z
23002574,OUTSIDE - O.P.S. OTHER,8/25/2023 14:42,Closed - Non-Criminal Case,8/22/2023 05:12,NULL,2400 N Antelope Valley Pky,2023-08-25T14:42:00Z
23002573,DISTURBANCE - OTHER,8/25/2023 14:17,Closed - Non-Criminal Case,8/25/2023 14:17,NULL,1130 N 14th St,2023-08-25T14:17:00Z
23002566,TRESPASSING,8/25/2023 01:43,Closed - Non-Criminal Case,8/25/2023 01:43,NULL,1400 R St,2023-08-25T01:43:00Z
23002565,ALCOHOL - MINOR IN POSSESSION,8/24/2023 23:24,Closed - Non-Criminal Case,8/24/2023 23:24,NULL,1801 R St,2023-08-24T23:24:00Z
23002562,TRESPASSING,8/24/2023 20:01,Closed - Non-Criminal Case,8/24/2023 20:01,NULL,700 N 17th St,2023-08-24T20:01:00Z
23002563,ACCIDENTS - P.D. H&R NOT REPORTABLE,8/24/2023 19:47,Closed - Inactive,8/22/2023 14:00,8/24/2023 14:30,1801 R St,2023-08-24T19:47:00Z
23002561,DISTURBANCE - OTHER,8/24/2023 18:13,Closed - Inactive,8/23/2023 12:00,8/24/2023 17:00,1120 N 14th St,2023-08-24T18:13:00Z
23002554,VANDALISM - OTHER,8/24/2023 14:39,Closed - Inactive,NULL,NULL,2400 N Antelope Valley Pky,2023-08-24T14:39:00Z
23002553,LOST OR STOLEN ITEM,8/24/2023 13:14,Closed - Inactive,NULL,NULL,300 N 17th St,2023-08-24T13:14:00Z
23002551,VANDALISM - OTHER,8/24/2023 12:16,Closed - Inactive,8/21/2023 18:30,8/24/2023 12:16,615 North 19th Street,2023-08-24T12:16:00Z
23002548,MISC - OTHER,8/24/2023 09:39,Closed - Non-Criminal Case,NULL,NULL,NA,2023-08-24T09:39:00Z
23002546,DISTURBANCE - OTHER,8/24/2023 08:34,Closed - Non-Criminal Case,8/23/2023 17:30,8/24/2023 07:30,501 N 14th St,2023-08-24T08:34:00Z
23002545,ACCIDENTS - P.D. H&R NOT REPORTABLE,8/24/2023 05:52,Closed - Inactive,8/24/2023 05:52,NULL,4000 East Campus Loop,2023-08-24T05:52:00Z
23002544,ALCOHOL - MINOR IN POSSESSION,8/24/2023 02:54,Closed - Non-Criminal Case,8/24/2023 02:54,NULL,1545 R St,2023-08-24T02:54:00Z
23002537,DISTURBANCE - OTHER,8/23/2023 17:52,Closed - Non-Criminal Case,NULL,NULL,1120 N 14th St,2023-08-23T17:52:00Z
23002536,SUSPICIOUS PERSON,8/23/2023 16:59,Closed - Non-Criminal Case,8/23/2023 12:20,8/23/2023 14:30,600 N 15th St,2023-08-23T16:59:00Z
23002535,ACCIDENTS - P.D. NOT REPORTABLE,8/23/2023 15:35,Closed - Non-Criminal Case,8/23/2023 15:35,NULL,1400 R St,2023-08-23T15:35:00Z
23002533,LARCENY - FROM BUILDING,8/23/2023 15:07,Closed - Inactive,8/23/2023 10:38,8/23/2023 13:33,733 N 17th St,2023-08-23T15:07:00Z
23002532,DISTURBANCE - OTHER,8/23/2023 14:54,Closed - Non-Criminal Case,8/23/2023 14:54,NULL,1400 R St,2023-08-23T14:54:00Z
23002525,OUTSIDE - O.P.S. OTHER,8/23/2023 01:38,Open,8/23/2023 01:38,NULL,300 N 17th St,2023-08-23T01:38:00Z
23002515,TRESPASSING,8/22/2023 15:17,Closed - Non-Criminal Case,8/22/2023 15:17,NULL,1525 U St,2023-08-22T15:17:00Z
23002509,ACCIDENTS - P.D. H&R NOT REPORTABLE,8/22/2023 11:41,Closed - Inactive,8/20/2023 16:35,8/22/2023 11:41,1801 R St,2023-08-22T11:41:00Z
23002504,ALCOHOL - MINOR IN POSSESSION,8/21/2023 23:18,Closed - Non-Criminal Case,8/21/2023 23:18,NULL,880 N 17th St,2023-08-21T23:18:00Z
23002503,MEDICAL EMERGENCY,8/21/2023 21:42,Closed - Non-Criminal Case,8/21/2023 19:30,NULL,880 N 17th St,2023-08-21T21:42:00Z
23002500,LOST OR STOLEN ITEM,8/21/2023 18:45,Closed - Inactive,8/18/2023 21:30,8/19/2023 21:00,200 Centennial Mall N,2023-08-21T18:45:00Z
23002499,SS - CHECK WELFARE OF PERSON,8/21/2023 16:44,Closed - Non-Criminal Case,NULL,NULL,300 N 17th St,2023-08-21T16:44:00Z
23002495,ACCIDENTS - P.D. H&R NOT REPORTABLE,8/21/2023 16:15,Closed - Inactive,8/21/2023 10:30,8/21/2023 16:05,N 37TH ST & FAIR ST,2023-08-21T16:15:00Z
23002493,ACCIDENTS - P.D. H&R NOT REPORTABLE,8/21/2023 15:50,Closed - Non-Criminal Case,8/21/2023 05:45,8/21/2023 15:30,905 N 14th St,2023-08-21T15:50:00Z
23002489,LOST OR STOLEN ITEM,8/21/2023 14:16,Closed - Non-Criminal Case,8/11/2023 13:00,8/21/2023 14:00,300 N 17th St,2023-08-21T14:16:00Z
23002490,PROTECTION ORDER VIOLATION,8/21/2023 14:06,Closed - Unfounded,8/13/2023 16:08,8/20/2023 21:45,880 N 16th St,2023-08-21T14:06:00Z
23002484,ACCIDENTS - P.D. H&R NOT REPORTABLE,8/21/2023 12:52,Closed - Inactive,8/21/2023 12:29,8/21/2023 12:52,1830 Vine St,2023-08-21T12:52:00Z
23002491,ACCIDENTS - P.D. NOT REPORTABLE,8/21/2023 12:50,Closed - Non-Criminal Case,8/21/2023 12:50,NULL,300 N 17th St,2023-08-21T12:50:00Z
23002480,LARCENY - OTHER OR FROM OPEN AREA,8/21/2023 10:41,Closed - Inactive,8/19/2023 12:30,8/19/2023 15:15,405 University Terrace,2023-08-21T10:41:00Z
23002479,TELEPHONE - OTHER,8/21/2023 10:26,Closed - Inactive,8/20/2023 21:55,NULL,1040 Y Street,2023-08-21T10:26:00Z
23002478,ACCIDENTS - P.D. H&R NOT REPORTABLE,8/21/2023 08:38,Closed - Inactive,8/18/2023 07:45,8/18/2023 16:45,501 Stadium Dr,2023-08-21T08:38:00Z
23002476,TRESPASSING,8/21/2023 07:57,Closed - Non-Criminal Case,8/21/2023 00:00,8/21/2023 08:43,1400 R St,2023-08-21T07:57:00Z
23002475,MEDICAL EMERGENCY,8/21/2023 01:21,Closed - Non-Criminal Case,8/21/2023 01:21,NULL,880 N 17th St,2023-08-21T01:21:00Z
23002472,ACCIDENTS - P.D. H&R NOT REPORTABLE,8/20/2023 21:23,Closed - Non-Criminal Case,8/20/2023 19:57,NULL,1801 R St,2023-08-20T21:23:00Z
23002467,LARCENY - FROM MOTOR VEHICLE,8/20/2023 11:45,Closed - Inactive,8/18/2023 14:00,8/19/2023 17:00,1830 Vine St,2023-08-20T11:45:00Z
23002462,NARCOTICS - OTHER,8/20/2023 03:18,Closed - Cleared by Arrest-Adult,8/20/2023 03:18,8/20/2023 04:14,300 N 17th St,2023-08-20T03:18:00Z
23002460,MEDICAL EMERGENCY,8/20/2023 00:19,Closed - Non-Criminal Case,8/20/2023 00:19,NULL,440 N 17th St,2023-08-20T00:19:00Z
23002457,NARCOTICS - OTHER,8/19/2023 22:24,Closed - Inactive,8/19/2023 22:24,NULL,820 N 17th St,2023-08-19T22:24:00Z
23002446,LARCENY - FROM MOTOR VEHICLE,8/19/2023 15:32,Closed - Inactive,8/19/2023 02:30,8/19/2023 04:30,1220 N 14th St,2023-08-19T15:32:00Z
23002439,VANDALISM - BY GRAFFITI,8/19/2023 11:33,Closed - Cleared by Arrest-Adult,8/17/2023 18:00,8/19/2023 11:00,615 N 19th St,2023-08-19T11:33:00Z
23002437,DISTURBANCE - OTHER,8/19/2023 03:32,Closed - Non-Criminal Case,8/19/2023 03:32,NULL,1120 N 14th St,2023-08-19T03:32:00Z
23002436,UNL POLICY VIOLATION -OTHER,8/19/2023 00:12,Closed - Non-Criminal Case,8/19/2023 00:12,NULL,1055 N 16th St,2023-08-19T00:12:00Z
23002433,ALCOHOL - USING FALSE I.D.,8/18/2023 18:44,Closed - Cleared by Arrest-Adult,8/18/2023 18:44,NULL,N 18TH ST & Q ST,2023-08-18T18:44:00Z
23002428,DISTURBANCE - OTHER,8/18/2023 11:57,Closed - Non-Criminal Case,8/18/2023 11:57,NULL,880 N 17th St,2023-08-18T11:57:00Z
23002427,ACCIDENTS - P.D. H&R NOT REPORTABLE,8/18/2023 10:56,Closed - Non-Criminal Case,8/18/2023 10:56,NULL,1780 R St,2023-08-18T10:56:00Z
23002426,VANDALISM - OTHER,8/18/2023 09:16,Closed - Inactive,NULL,NULL,1300 R St,2023-08-18T09:16:00Z
23002425,TRESPASSING,8/18/2023 02:47,Closed - Cleared by Arrest-Adult,8/18/2023 02:47,NULL,1220 N 14th St,2023-08-18T02:47:00Z
23002423,DISTURBANCE - OTHER,8/17/2023 21:59,Closed - Non-Criminal Case,8/17/2023 21:20,NULL,1150 N 14th St,2023-08-17T21:59:00Z
23002422,MEDICAL EMERGENCY,8/17/2023 20:49,Closed - Non-Criminal Case,8/17/2023 20:49,NULL,1150 N 14th St,2023-08-17T20:49:00Z
23002419,DISTURBANCE - OTHER,8/17/2023 19:05,Closed - Non-Criminal Case,8/17/2023 19:05,NULL,301 N 12th St,2023-08-17T19:05:00Z
23002420,SS - CHECK WELFARE OF PERSON,8/17/2023 17:01,Closed - Non-Criminal Case,8/15/2023 20:00,8/16/2023 22:00,433 N 19th St,2023-08-17T17:01:00Z
23002417,LARCENY - FROM BUILDING,8/17/2023 10:09,Closed - Cleared by Arrest-Adult,8/17/2023 02:18,NULL,880 N 17th St,2023-08-17T10:09:00Z
23002414,NARCOTICS - POSSESSION,8/16/2023 23:40,Closed - Cleared by Arrest-Adult,8/16/2023 23:40,NULL,1801 R St,2023-08-16T23:40:00Z
23002413,TRESPASSING,8/16/2023 22:31,Closed - Non-Criminal Case,8/16/2023 22:31,NULL,1144 T St,2023-08-16T22:31:00Z
23002412,TRESPASSING,8/16/2023 20:57,Closed - Cleared by Exception,8/16/2023 20:57,NULL,405 University Terrace,2023-08-16T20:57:00Z
23002411,DISTURBANCE - OTHER,8/16/2023 17:36,Closed - Inactive,8/16/2023 17:15,8/16/2023 17:25,1433 R St,2023-08-16T17:36:00Z
23002406,LOST OR STOLEN ITEM,8/16/2023 15:00,Closed - Non-Criminal Case,8/15/2023 16:00,8/16/2023 15:00,300 N 17th St,2023-08-16T15:00:00Z
23002405,DISTURBANCE - OTHER,8/16/2023 13:16,Closed - Non-Criminal Case,6/7/2023 12:06,8/15/2023 06:25,3310 Holdrege St,2023-08-16T13:16:00Z
23002404,LOST OR STOLEN ITEM,8/16/2023 12:58,Closed - Inactive,NULL,NULL,1931 N Antelope Valley Pky,2023-08-16T12:58:00Z
23002399,TRESPASSING,8/15/2023 22:15,Closed - Non-Criminal Case,8/15/2023 22:15,NULL,1300 R St,2023-08-15T22:15:00Z
23002393,TRESPASSING,8/15/2023 05:06,Closed - Cleared by Arrest-Adult,8/15/2023 05:06,NULL,1248 R St,2023-08-15T05:06:00Z
23002392,ALCOHOL - MINOR IN POSSESSION,8/15/2023 02:28,Closed - Non-Criminal Case,8/15/2023 02:28,NULL,1515 R St,2023-08-15T02:28:00Z
23002391,AUTO THEFT,8/14/2023 21:01,Closed - Inactive,8/14/2023 21:01,NULL,716 N 16th St,2023-08-14T21:01:00Z
23002387,ACCIDENTS - P.D. H&R NOT REPORTABLE,8/14/2023 15:03,Closed - Non-Criminal Case,8/14/2023 12:32,NULL,733 N 17th St,2023-08-14T15:03:00Z
23002385,ACCIDENTS - P.D. H&R NOT REPORTABLE,8/14/2023 13:34,Closed - Cleared by Arrest-Adult,8/12/2023 15:25,8/12/2023 16:45,745 N 14th St,2023-08-14T13:34:00Z
23002383,ACCIDENTS - P.D. NOT REPORTABLE,8/14/2023 11:29,Closed - Non-Criminal Case,NULL,NULL,615 N 19th St,2023-08-14T11:29:00Z
23002380,SUSPICIOUS PERSON,8/14/2023 08:19,Closed - Non-Criminal Case,8/13/2023 11:00,8/13/2023 13:00,N 39TH ST & CENTER DR,2023-08-14T08:19:00Z
23002371,NARCOTICS - POSSESSION,8/13/2023 02:26,Closed - Cleared by Arrest-Adult,8/13/2023 02:26,NULL,200 Centennial Mall N,2023-08-13T02:26:00Z
23002370,TRESPASSING,8/13/2023 00:40,Closed - Non-Criminal Case,8/13/2023 00:40,NULL,200 Centennial Mall N,2023-08-13T00:40:00Z
23002356,LARCENY - FROM BUILDING,8/11/2023 16:19,Closed - Cleared by Arrest-Adult,8/10/2023 16:00,8/10/2023 17:25,1400 R St,2023-08-11T16:19:00Z
23002355,LOST OR STOLEN ITEM,8/11/2023 15:03,Closed - Inactive,8/10/2023 16:15,8/10/2023 16:50,841 N 14th St,2023-08-11T15:03:00Z
23002353,"PROPERTY DAMAGE - UNINTENTIONAL,NON TRAFFIC",8/11/2023 10:34,Closed - Non-Criminal Case,8/7/2023 12:28,NULL,501 Stadium Dr,2023-08-11T10:34:00Z
23002349,PROTECTION ORDER VIOLATION,8/11/2023 05:37,Closed - Cleared by Arrest-Adult,8/11/2023 05:37,NULL,1400 R St,2023-08-11T05:37:00Z
23002350,TRESPASSING,8/11/2023 05:37,Closed - Non-Criminal Case,8/11/2023 05:37,NULL,1400 R St,2023-08-11T05:37:00Z
23002348,TRESPASSING,8/11/2023 01:01,Closed - Non-Criminal Case,8/11/2023 01:01,NULL,503 N 14th St,2023-08-11T01:01:00Z
23002337,ALCOHOL - DWI,8/10/2023 05:32,Closed - Cleared by Arrest-Adult,8/10/2023 05:32,NULL,N 16TH ST & VINE ST,2023-08-10T05:32:00Z
23002336,TRESPASSING,8/9/2023 23:49,Closed - Non-Criminal Case,8/9/2023 23:49,NULL,ANTELOPE VALLEY PARKWAY & MILITARY RD,2023-08-09T23:49:00Z
23002335,LOST OR STOLEN ITEM,8/9/2023 21:31,Closed - Inactive,8/4/2023 00:01,8/9/2023 21:31,3301 Starr St,2023-08-09T21:31:00Z
23002332,LARCENY - STOLEN BIKE,8/9/2023 13:12,Closed - Cleared by Arrest-Adult,8/8/2023 19:00,8/9/2023 10:00,1055 N 16th St,2023-08-09T13:12:00Z
23002331,TELEPHONE - OTHER,8/9/2023 09:58,Closed - Non-Criminal Case,8/9/2023 09:37,NULL,3835 Holdrege St,2023-08-09T09:58:00Z
23002315,ALCOHOL - DRUNK,8/5/2023 23:27,Closed - Non-Criminal Case,8/5/2023 23:27,NULL,1510 Vine St,2023-08-05T23:27:00Z
23002313,SS - CHECK WELFARE OF PERSON,8/5/2023 21:55,Closed - Non-Criminal Case,NULL,NULL,1801 R St,2023-08-05T21:55:00Z
23002308,NARCOTICS - POSSESSION,8/4/2023 22:08,Closed - Cleared by Arrest-Adult,8/4/2023 22:08,NULL,N 21ST ST & TRANSFORMATION DR,2023-08-04T22:08:00Z
23002303,DISTURBANCE - OTHER,8/4/2023 15:44,Closed - Non-Criminal Case,8/4/2023 15:44,NULL,1300 R St,2023-08-04T15:44:00Z
23002300,LOST OR STOLEN ITEM,8/4/2023 13:57,Closed - Inactive,NULL,NULL,1931 N Antelope Valley Pky,2023-08-04T13:57:00Z
23002302,LARCENY - STOLEN BIKE,8/4/2023 13:46,Closed - Inactive,8/3/2023 07:30,8/3/2023 16:15,2200 Vine St,2023-08-04T13:46:00Z
23002298,ALCOHOL - USING FALSE I.D.,8/3/2023 21:09,Closed - Cleared by Arrest-Adult,8/3/2023 21:09,NULL,841 N 14th St,2023-08-03T21:09:00Z
23002296,LARCENY - STOLEN BIKE,8/3/2023 18:00,Closed - Cleared by Arrest-Adult,NULL,NULL,1055 N 16th St,2023-08-03T18:00:00Z
23002295,LARCENY - STOLEN BIKE,8/3/2023 17:06,Closed - Inactive,8/3/2023 07:30,8/3/2023 17:00,1801 R St,2023-08-03T17:06:00Z
23002292,SUSPICIOUS PERSON,8/3/2023 14:28,Closed - Inactive,8/3/2023 14:00,NULL,600 N 15th St,2023-08-03T14:28:00Z
23002291,MEDICAL EMERGENCY,8/3/2023 13:53,Closed - Non-Criminal Case,8/3/2023 13:53,NULL,301 N 12th St,2023-08-03T13:53:00Z
23002283,DISTURBANCE - OTHER,8/2/2023 10:47,Closed - Non-Criminal Case,7/26/2023 13:30,7/26/2023 13:46,841 N 14th St,2023-08-02T10:47:00Z
23002278,LARCENY - OTHER OR FROM OPEN AREA,8/2/2023 03:37,Closed - Inactive,8/2/2023 03:24,8/2/2023 03:29,2100 Vine Street,2023-08-02T03:37:00Z
23002277,TRESPASSING,8/1/2023 22:51,Closed - Cleared by Arrest-Adult,8/1/2023 01:00,8/1/2023 04:58,1248 R St,2023-08-01T22:51:00Z
23002276,NARCOTICS - POSSESSION,8/1/2023 21:25,Closed - Cleared by Arrest-Adult,8/1/2023 21:25,NULL,300 N 17th St,2023-08-01T21:25:00Z
23002274,LARCENY - FROM BUILDING,8/1/2023 14:06,Open,7/25/2023 19:07,NULL,730 N 14th St,2023-08-01T14:06:00Z
23002272,DISTURBANCE - DOMESTIC,8/1/2023 12:29,Closed - Unfounded,8/1/2023 12:29,NULL,844 N 16th St,2023-08-01T12:29:00Z
23002270,TRESPASSING,8/1/2023 06:00,Closed - Inactive,8/1/2023 06:00,NULL,200 Centennial Mall N,2023-08-01T06:00:00Z
23002265,DISTURBANCE - OTHER,7/31/2023 10:45,Closed - Non-Criminal Case,7/31/2023 10:45,NULL,300 N 17th St,2023-07-31T10:45:00Z
23002259,TRAFFIC - SUSPENDED DRIVER,7/30/2023 00:31,Closed - Cleared by Arrest-Adult,7/30/2023 00:31,NULL,N 16TH ST & Q ST,2023-07-30T00:31:00Z
23002256,TRAFFIC - SUSPENDED DRIVER,7/29/2023 23:39,Closed - Cleared by Arrest-Adult,7/29/2023 23:39,NULL,P ST & N 13TH ST,2023-07-29T23:39:00Z
23002257,ALCOHOL - USING FALSE I.D.,7/29/2023 00:57,Closed - Cleared by Arrest-Adult,7/29/2023 00:57,NULL,N 17TH ST & Q ST,2023-07-29T00:57:00Z
23002249,TRESPASSING,7/28/2023 06:01,Closed - Non-Criminal Case,7/28/2023 06:01,NULL,1410 Q St,2023-07-28T06:01:00Z
23002239,LARCENY - FROM BUILDING,7/27/2023 22:47,Closed - Non-Criminal Case,7/26/2023 21:52,7/26/2023 22:10,433 V St,2023-07-27T22:47:00Z
23002236,VANDALISM - OTHER,7/26/2023 19:23,Closed - Inactive,7/24/2023 20:30,7/25/2023 08:00,4075 East Campus Loop S,2023-07-26T19:23:00Z
23002235,SS - CHECK WELFARE OF PERSON,7/26/2023 18:38,Closed - Non-Criminal Case,7/26/2023 18:20,7/26/2023 18:30,N 13TH ST & R ST,2023-07-26T18:38:00Z
23002234,OUTSIDE - O.P.S. OTHER,7/26/2023 11:30,Closed - Non-Criminal Case,NULL,NULL,1335 N 22 Street,2023-07-26T11:30:00Z
23002231,EXTORTION,7/25/2023 23:19,Open,7/24/2023 13:00,7/25/2023 23:19,300 N 17th St,2023-07-25T23:19:00Z
23002225,VANDALISM - OTHER,7/25/2023 18:18,Closed - Non-Criminal Case,7/23/2023 18:00,7/25/2023 18:10,1931 N Antelope Valley Pky,2023-07-25T18:18:00Z
23002216,TRESPASSING,7/25/2023 07:34,Closed - Non-Criminal Case,7/25/2023 07:34,NULL,301 N 12th St,2023-07-25T07:34:00Z
23002223,ACCIDENTS - P.D. H&R NOT REPORTABLE,7/25/2023 00:05,Closed - Inactive,NULL,NULL,942 N 22nd St,2023-07-25T00:05:00Z
23002213,TRESPASSING,7/24/2023 19:33,Closed - Non-Criminal Case,7/24/2023 18:47,7/24/2023 19:33,1433 W St,2023-07-24T19:33:00Z
23002214,DISTURBANCE - OTHER,7/24/2023 16:48,Closed - Inactive,NULL,NULL,NA,2023-07-24T16:48:00Z
23002212,LARCENY - OTHER OR FROM OPEN AREA,7/24/2023 16:00,Closed - Cleared by Arrest-Adult,7/21/2023 17:00,7/23/2023 06:00,1100 T St,2023-07-24T16:00:00Z
23002209,"PROPERTY DAMAGE - UNINTENTIONAL,NON TRAFFIC",7/24/2023 14:25,Closed - Non-Criminal Case,7/19/2023 12:55,7/24/2023 13:30,300 N 17th St,2023-07-24T14:25:00Z
23002206,MEDICAL EMERGENCY,7/24/2023 08:21,Closed - Non-Criminal Case,7/24/2023 08:21,NULL,1705 Arbor Dr,2023-07-24T08:21:00Z
23002205,TRESPASSING,7/24/2023 04:43,Closed - Cleared by Arrest-Adult,7/24/2023 04:43,NULL,1300 R St,2023-07-24T04:43:00Z
23002204,ALCOHOL - DRUNK,7/24/2023 00:51,Closed - Non-Criminal Case,7/24/2023 00:51,NULL,440 N 17th St,2023-07-24T00:51:00Z
23002202,DISTURBANCE - OTHER,7/23/2023 17:30,Closed - Cleared by Arrest-Adult,7/23/2023 17:30,NULL,1400 R St,2023-07-23T17:30:00Z
23002200,ACCIDENTS - P.D. H&R NOT REPORTABLE,7/23/2023 14:57,Closed - Cleared by Arrest-Adult,7/23/2023 14:47,NULL,VINE ST & N 14TH ST,2023-07-23T14:57:00Z
23002196,OUTSIDE - O.P.S. OTHER,7/23/2023 06:22,Closed - Non-Criminal Case,NULL,NULL,NA,2023-07-23T06:22:00Z
23002195,NARCOTICS - POSSESSION,7/23/2023 02:23,Closed - Cleared by Arrest-Adult,7/23/2023 02:23,NULL,N 19TH ST & S ST,2023-07-23T02:23:00Z
23002189,NARCOTICS - SALE/DELIVER,7/21/2023 22:46,Closed - Cleared by Arrest-Adult,7/21/2023 22:46,NULL,N 14TH ST & R ST,2023-07-21T22:46:00Z
23002181,VANDALISM - OTHER,7/21/2023 10:05,Closed - Inactive,NULL,NULL,745 N 14th St,2023-07-21T10:05:00Z
23002167,ACCIDENTS - P.D. NOT REPORTABLE,7/20/2023 12:37,Closed - Non-Criminal Case,7/20/2023 12:37,NULL,1650 N 35th St,2023-07-20T12:37:00Z
23002168,TELEPHONE - OTHER,7/20/2023 11:48,Closed - Inactive,7/20/2023 11:29,NULL,1400 R St,2023-07-20T11:48:00Z
23002163,WEAPONS  OTHER,7/19/2023 20:30,Closed - Inactive,7/19/2023 20:27,7/19/2023 20:29,1010 N 14th St,2023-07-19T20:30:00Z
23002162,SUSPICIOUS PERSON,7/19/2023 13:24,Closed - Non-Criminal Case,7/14/2023 11:00,NULL,3835 Holdrege St,2023-07-19T13:24:00Z
23002155,ACCIDENTS - P.D. NOT REPORTABLE,7/18/2023 11:55,Closed - Non-Criminal Case,7/18/2023 11:50,NULL,200 Centennial Mall N,2023-07-18T11:55:00Z
23002154,DISTURBANCE - OTHER,7/18/2023 09:12,Closed - Inactive,7/18/2023 09:02,7/18/2023 09:07,NA,2023-07-18T09:12:00Z
23002152,TELEPHONE - OTHER,7/17/2023 15:32,Closed - Non-Criminal Case,7/17/2023 14:59,7/17/2023 15:41,1400 R St,2023-07-17T15:32:00Z
23002141,OUTSIDE - O.P.S. OTHER,7/15/2023 13:19,Closed - Cleared by Arrest-Adult,7/15/2023 13:19,NULL,1601 Q st,2023-07-15T13:19:00Z
23002135,"PROPERTY DAMAGE - UNINTENTIONAL,NON TRAFFIC",7/14/2023 21:30,Closed - Non-Criminal Case,7/7/2023 21:00,7/14/2023 21:30,503 N 14th St,2023-07-14T21:30:00Z
23002133,FIRE - FALSE ALARM,7/14/2023 17:09,Closed - Non-Criminal Case,7/14/2023 17:09,NULL,1130 N 14th St,2023-07-14T17:09:00Z
23002127,SUSPICIOUS VEHICLE,7/14/2023 06:23,Closed - Non-Criminal Case,7/14/2023 06:05,NULL,440 N 17th St,2023-07-14T06:23:00Z
23002126,EXTORTION,7/13/2023 23:38,Closed - Inactive,7/13/2023 22:00,NULL,880 N 17th St,2023-07-13T23:38:00Z
23002124,OUTSIDE - O.P.S. OTHER,7/13/2023 20:45,Closed - Non-Criminal Case,7/13/2023 20:45,NULL,NA,2023-07-13T20:45:00Z
23002121,DISTURBANCE - OTHER,7/13/2023 16:52,Closed - Non-Criminal Case,7/13/2023 16:20,7/13/2023 16:35,845 N 14th St,2023-07-13T16:52:00Z
23002117,TELEPHONE - OTHER,7/13/2023 12:45,Closed - Inactive,7/13/2023 12:00,7/13/2023 12:15,1400 R St,2023-07-13T12:45:00Z
23002107,LARCENY - OTHER OR FROM OPEN AREA,7/12/2023 19:08,Closed - Cleared by Arrest-Adult,7/12/2023 18:54,NULL,1400 R St,2023-07-12T19:08:00Z
23002098,LARCENY - OTHER OR FROM OPEN AREA,7/11/2023 15:44,Closed - Cleared by Arrest-Adult,7/11/2023 06:14,NULL,616 N 16th St,2023-07-11T15:44:00Z
23002097,DISTURBANCE - OTHER,7/11/2023 12:28,Closed - Non-Criminal Case,7/11/2023 11:54,7/11/2023 12:28,1400 R St,2023-07-11T12:28:00Z
23002093,ALCOHOL - DWI,7/11/2023 00:38,Closed - Cleared by Arrest-Adult,7/11/2023 00:38,NULL,N 27TH ST & VINE ST,2023-07-11T00:38:00Z
OS23003,STALKING,7/10/2023 10:44,NA - Clery Report Only,1/1/2023 12:00,5/12/2023 12:00,On Campus,2023-07-10T10:44:00Z
OS23002,STALKING,7/10/2023 10:39,NA - Clery Report Only,NULL,NULL,Residence Hall,2023-07-10T10:39:00Z
23002084,TRAFFIC - SUSPENDED DRIVER,7/10/2023 01:00,Closed - Cleared by Arrest-Adult,7/10/2023 01:00,7/10/2023 01:20,N 22ND ST & Q ST,2023-07-10T01:00:00Z
23002083,LARCENY - STOLEN BIKE,7/9/2023 20:29,Closed - Inactive,7/8/2023 20:00,7/9/2023 17:00,3344 Starr St,2023-07-09T20:29:00Z
23002076,TRESPASSING,7/8/2023 10:25,Closed - Non-Criminal Case,7/8/2023 10:25,NULL,1801 R St,2023-07-08T10:25:00Z
23002073,ACCIDENTS - P.D. NOT REPORTABLE,7/8/2023 03:59,Closed - Non-Criminal Case,7/8/2023 03:55,NULL,1220 N 14th St,2023-07-08T03:59:00Z
23002072,TRAFFIC - SUSPENDED DRIVER,7/7/2023 21:57,Closed - Cleared by Arrest-Adult,7/7/2023 21:57,NULL,N 16TH ST & Q ST,2023-07-07T21:57:00Z
23002087,DISTURBANCE - OTHER,7/7/2023 16:18,Closed - Inactive,7/5/2023 11:47,NULL,NA,2023-07-07T16:18:00Z
23002070,ACCIDENTS - P.D. NOT REPORTABLE,7/7/2023 14:05,Closed - Inactive,7/6/2023 13:30,NULL,1650 N 35th St,2023-07-07T14:05:00Z
23002066,FRAUD - CON GAMES/DECEPTION/FALSE    PRETENSE/OTHER,7/7/2023 09:36,Closed - Inactive,7/5/2023 12:00,7/5/2023 14:00,NA,2023-07-07T09:36:00Z
23002056,TRESPASSING,7/6/2023 09:35,Closed - Non-Criminal Case,7/6/2023 09:35,NULL,1520 R St,2023-07-06T09:35:00Z
23002052,TELEPHONE - OBSCENE CALLS,7/6/2023 09:04,Closed - Inactive,7/6/2023 08:51,7/6/2023 08:55,1825 N 38th St,2023-07-06T09:04:00Z
23002046,AUTO THEFT,7/5/2023 18:04,Closed - Cleared by Arrest-Adult,7/5/2023 13:05,NULL,1535 R St,2023-07-05T18:04:00Z
23002038,MEDICAL EMERGENCY,7/5/2023 00:22,Closed - Non-Criminal Case,7/5/2023 00:22,NULL,1801 R St,2023-07-05T00:22:00Z
23002036,LARCENY - FROM MOTOR VEHICLE,7/4/2023 14:48,Closed - Cleared by Arrest-Adult,7/4/2023 02:45,7/4/2023 02:46,1705 Arbor Dr,2023-07-04T14:48:00Z
23002028,LARCENY - STOLEN BIKE,7/3/2023 10:27,Closed - Inactive,6/30/2023 09:00,7/3/2023 10:00,3310 Holdrege St,2023-07-03T10:27:00Z
23002023,OUTSIDE - O.P.S. OTHER,7/1/2023 12:20,Closed - Non-Criminal Case,7/1/2023 12:20,NULL,N 35TH ST & HUNTINGTON AVE,2023-07-01T12:20:00Z
23002018,DISTURBANCE - OTHER,6/30/2023 08:49,Closed - Non-Criminal Case,6/30/2023 08:49,NULL,200 Centennial Mall N,2023-06-30T08:49:00Z
23002014,FALSE INFORMATION - GIVEN TO OFC.,6/30/2023 00:43,Closed - Cleared by Arrest-Adult,6/30/2023 00:43,NULL,1400 R St,2023-06-30T00:43:00Z
23002012,OUTSIDE - O.P.S. OTHER,6/29/2023 20:10,Closed - Non-Criminal Case,6/29/2023 20:10,NULL,N 20TH ST & U ST,2023-06-29T20:10:00Z
23002006,TRESPASSING,6/29/2023 02:15,Closed - Non-Criminal Case,6/29/2023 02:15,NULL,1144 T St,2023-06-29T02:15:00Z
23002005,LARCENY - OTHER OR FROM OPEN AREA,6/28/2023 21:59,Closed - Inactive,6/28/2023 21:00,6/28/2023 21:50,1150 N 14th St,2023-06-28T21:59:00Z
23002002,FIRE - FALSE ALARM,6/28/2023 15:59,Closed - Non-Criminal Case,6/28/2023 15:59,NULL,1150 N 14th St,2023-06-28T15:59:00Z
23001994,VANDALISM - OTHER,6/27/2023 17:01,Closed - Inactive,NULL,NULL,1140 N 14th St,2023-06-27T17:01:00Z
23001992,VANDALISM - OTHER,6/27/2023 12:18,Closed - Inactive,6/26/2023 15:00,6/27/2023 12:00,820 N 16th St,2023-06-27T12:18:00Z
23001976,NARCOTICS - POSSESSION,6/24/2023 01:29,Closed - Cleared by Arrest-Adult,6/24/2023 01:29,NULL,R ST & N 14TH ST,2023-06-24T01:29:00Z
23001972,DISTURBANCE - OTHER,6/23/2023 12:24,Closed - Non-Criminal Case,6/22/2023 15:02,6/22/2023 15:43,200 Centennial Mall N,2023-06-23T12:24:00Z
23001963,FIRE - FALSE ALARM,6/22/2023 21:22,Closed - Non-Criminal Case,6/22/2023 21:22,NULL,1130 N 14th St,2023-06-22T21:22:00Z
23001959,LARCENY - FROM BUILDING,6/22/2023 17:32,Closed - Inactive,6/21/2023 21:45,NULL,1130 N 14th St,2023-06-22T17:32:00Z
23001958,OUTSIDE - O.P.S. OTHER,6/22/2023 16:48,Closed - Non-Criminal Case,6/12/2023 00:00,6/22/2023 16:48,300 N 17th St,2023-06-22T16:48:00Z
23001945,TRAFFIC - SUSPENDED DRIVER,6/21/2023 11:29,Closed - Cleared by Arrest-Adult,6/21/2023 11:29,NULL,N 17TH ST & P ST,2023-06-21T11:29:00Z
23001943,TRESPASSING,6/21/2023 05:47,Closed - Non-Criminal Case,6/21/2023 05:47,NULL,1248 R St,2023-06-21T05:47:00Z
23001939,ACCIDENTS - P.D. H&R NOT REPORTABLE,6/20/2023 17:14,Closed - Inactive,6/20/2023 08:30,6/20/2023 15:30,N 39TH ST & CENTER ST,2023-06-20T17:14:00Z
23001937,SS - CHECK WELFARE OF PERSON,6/20/2023 16:17,Closed - Non-Criminal Case,6/20/2023 14:00,NULL,1875 N 38th St,2023-06-20T16:17:00Z
23001935,VANDALISM - OTHER,6/20/2023 13:55,Closed - Inactive,6/20/2023 08:30,6/20/2023 13:00,1220 T St,2023-06-20T13:55:00Z
23001933,ACCIDENTS - P.D. H&R NOT REPORTABLE,6/20/2023 13:18,Closed - Inactive,6/20/2023 07:50,6/20/2023 13:00,615 N 19th St,2023-06-20T13:18:00Z
23001927,TRAFFIC - OTHER,6/19/2023 22:31,Closed - Inactive,6/19/2023 22:31,NULL,ANTELOPE VALLEY PARKWAY & VINE ST,2023-06-19T22:31:00Z
23001921,VANDALISM - OTHER,6/19/2023 14:05,Closed - Inactive,NULL,NULL,1915 N 37th St,2023-06-19T14:05:00Z
23001917,TRAFFIC - SUSPENDED DRIVER,6/19/2023 01:05,Closed - Cleared by Arrest-Adult,6/19/2023 01:05,NULL,N 14TH ST & R ST,2023-06-19T01:05:00Z
23001916,TRESPASSING,6/18/2023 23:03,Closed - Non-Criminal Case,6/18/2023 23:03,NULL,1100 T St,2023-06-18T23:03:00Z
23001908,ACCIDENTS - P.D. NOT REPORTABLE,6/17/2023 12:04,Closed - Non-Criminal Case,6/17/2023 11:49,NULL,615 N 19th St,2023-06-17T12:04:00Z
23001905,TRAFFIC - SUSPENDED DRIVER,6/17/2023 01:23,Closed - Cleared by Arrest-Adult,6/17/2023 01:23,NULL,CENTENNIAL MALL & P ST,2023-06-17T01:23:00Z
23001900,TRAFFIC - SUSPENDED DRIVER,6/16/2023 13:00,Closed - Cleared by Arrest-Adult,6/16/2023 13:00,NULL,433 V St,2023-06-16T13:00:00Z
23001892,TRESPASSING,6/16/2023 08:09,Closed - Inactive,6/16/2023 08:09,NULL,200 Centennial Mall N,2023-06-16T08:09:00Z
23001891,VANDALISM - OTHER,6/16/2023 02:31,Closed - Inactive,6/15/2023 02:14,6/16/2023 02:14,1220 T St,2023-06-16T02:31:00Z
23001890,SS - CHECK WELFARE OF PERSON,6/15/2023 23:52,Closed - Non-Criminal Case,6/15/2023 23:30,6/15/2023 23:59,1710 Arbor Dr,2023-06-15T23:52:00Z
23001885,LOST OR STOLEN ITEM,6/15/2023 17:32,Closed - Non-Criminal Case,6/15/2023 11:10,NULL,730 N 14th St,2023-06-15T17:32:00Z
23001877,AUTO THEFT,6/14/2023 16:54,Closed - Cleared by Arrest-Adult,6/14/2023 14:35,NULL,3855 Merrill St,2023-06-14T16:54:00Z
23001871,ACCIDENTS - P.D. NOT REPORTABLE,6/14/2023 10:57,Closed - Non-Criminal Case,6/14/2023 09:23,NULL,301 N 12th St,2023-06-14T10:57:00Z
23001868,OUTSIDE - O.P.S. OTHER,6/14/2023 00:58,Closed - Non-Criminal Case,6/14/2023 00:58,6/14/2023 00:58,136 N. 14th Street,2023-06-14T00:58:00Z
23001864,DISTURBANCE - OTHER,6/13/2023 14:32,Closed - Non-Criminal Case,6/9/2023 16:15,6/9/2023 18:30,1875 N 42nd St,2023-06-13T14:32:00Z
23001858,LARCENY - FROM BUILDING,6/12/2023 18:52,Closed - Cleared by Arrest-Adult,6/12/2023 18:30,NULL,1400 R St,2023-06-12T18:52:00Z
23001847,TRESPASSING,6/11/2023 12:25,Closed - Non-Criminal Case,6/11/2023 12:25,6/11/2023 13:30,1650 N 35th St,2023-06-11T12:25:00Z
23001846,NARCOTICS - POSSESSION,6/10/2023 23:06,Closed - Cleared by Arrest-Adult,6/10/2023 23:06,NULL,N ANTELOPE VALLEY PKWY & Salt Creek RDWY,2023-06-10T23:06:00Z
23001845,DISTURBANCE - OTHER,6/10/2023 20:12,Closed - Non-Criminal Case,6/10/2023 19:30,NULL,841 N 14th St,2023-06-10T20:12:00Z
23001843,DISTURBANCE - OTHER,6/9/2023 22:19,Closed - Non-Criminal Case,6/9/2023 22:19,NULL,1100 T St,2023-06-09T22:19:00Z
23001836,DISTURBANCE - OTHER,6/9/2023 07:42,Closed - Inactive,6/8/2023 22:00,6/8/2023 23:00,1120 N 14th St,2023-06-09T07:42:00Z
23001833,ALCOHOL - USING FALSE I.D.,6/9/2023 01:05,Closed - Cleared by Arrest-Adult,6/9/2023 01:05,NULL,R ST & N 16TH ST,2023-06-09T01:05:00Z
23001826,MEDICAL EMERGENCY,6/8/2023 14:32,Closed - Non-Criminal Case,6/8/2023 10:45,NULL,530 N 17th St,2023-06-08T14:32:00Z
23001827,DISTURBANCE - OTHER,6/8/2023 14:18,Closed - Cleared by Arrest-Adult,6/8/2023 14:18,NULL,1525 U St,2023-06-08T14:18:00Z
23001824,OUTSIDE - O.P.S. OTHER,6/8/2023 12:30,Closed - Non-Criminal Case,12/31/2023 02:00,NULL,811 N St,2023-06-08T12:30:00Z
23001822,LARCENY - OTHER OR FROM OPEN AREA,6/8/2023 08:43,Closed - Cleared by Arrest-Adult,6/5/2023 19:37,NULL,844 N 16th St,2023-06-08T08:43:00Z
23001820,DISTURBANCE - OTHER,6/7/2023 15:59,Closed - Non-Criminal Case,6/7/2023 15:59,NULL,2225 W St,2023-06-07T15:59:00Z
23001818,DISTURBANCE - OTHER,6/7/2023 15:04,Open,6/7/2023 14:37,NULL,550 N 19th St,2023-06-07T15:04:00Z
23001816,NARCOTICS - OTHER,6/7/2023 10:38,Closed - Non-Criminal Case,NULL,NULL,SALT CREEK RDWY & N 14TH ST,2023-06-07T10:38:00Z
23001814,SEX OFFENSE - INDECENT EXPOSURE,6/6/2023 19:13,Closed - Inactive,6/4/2023 19:10,NULL,NA,2023-06-06T19:13:00Z
23001810,FIRE - FALSE ALARM,6/6/2023 18:02,Closed - Inactive,6/6/2023 18:02,NULL,1120 N 14th St,2023-06-06T18:02:00Z
23001806,BURGLARY,6/6/2023 16:17,Closed - Inactive,6/6/2023 03:30,6/6/2023 03:31,3601 Apple St,2023-06-06T16:17:00Z
23001808,ACCIDENTS - P.D. H&R NOT REPORTABLE,6/6/2023 15:05,Closed - Non-Criminal Case,6/6/2023 14:50,6/6/2023 15:00,501 N 14th St,2023-06-06T15:05:00Z
23001803,TRAFFIC - OTHER,6/5/2023 23:49,Closed - Inactive,6/5/2023 23:49,NULL,1830 Vine St,2023-06-05T23:49:00Z
23001797,"PROPERTY DAMAGE - UNINTENTIONAL,NON TRAFFIC",6/5/2023 15:47,Closed - Non-Criminal Case,6/5/2023 15:47,NULL,1111 Salt Creek Rdwy,2023-06-05T15:47:00Z
23001795,TRAFFIC - SUSPENDED DRIVER,6/5/2023 10:03,Closed - Cleared by Arrest-Adult,6/5/2023 10:03,NULL,W ST & N 16TH ST,2023-06-05T10:03:00Z
23001794,VANDALISM - OTHER,6/5/2023 07:59,Closed - Inactive,6/4/2023 08:00,6/5/2023 07:50,1248 R St,2023-06-05T07:59:00Z
23001785,ALCOHOL - DWI,6/3/2023 23:10,Closed - Cleared by Arrest-Adult,6/3/2023 23:10,NULL,N 12TH ST & R ST,2023-06-03T23:10:00Z
23001778,ALCOHOL - DRUNK,6/2/2023 12:29,Closed - Non-Criminal Case,6/2/2023 12:27,NULL,200 Centennial Mall N,2023-06-02T12:29:00Z
23001770,OUTSIDE - O.P.S. OTHER,6/1/2023 13:10,Closed - Inactive,5/16/2023 19:50,5/16/2023 19:57,Q ST & N 16TH ST,2023-06-01T13:10:00Z
23001766,LOST OR STOLEN ITEM,5/31/2023 19:31,Closed - Non-Criminal Case,5/27/2023 12:00,5/30/2023 17:00,530 N 17th St,2023-05-31T19:31:00Z
23001760,VANDALISM - OTHER,5/31/2023 13:55,Closed - Inactive,5/26/2023 17:00,5/31/2023 13:55,N 38TH ST & EAST CAMPUS LOOP,2023-05-31T13:55:00Z
23001761,OUTSIDE - O.P.S. OTHER,5/31/2023 13:20,Closed - Non-Criminal Case,4/21/2023 00:01,5/30/2023 01:56,790 Atlantic Drive,2023-05-31T13:20:00Z
23001762,DISTURBANCE - OTHER,5/31/2023 12:47,Closed - Inactive,5/30/2023 02:46,5/30/2023 10:36,1110 S 67th St,2023-05-31T12:47:00Z
23001758,MEDICAL EMERGENCY,5/31/2023 09:42,Closed - Non-Criminal Case,5/31/2023 09:42,NULL,1433 W St,2023-05-31T09:42:00Z
23001757,LOST OR STOLEN ITEM,5/31/2023 08:53,Closed - Non-Criminal Case,5/30/2023 23:30,5/30/2023 23:59,1780 R St,2023-05-31T08:53:00Z
23001749,LARCENY - STOLEN BIKE,5/30/2023 14:15,Closed - Non-Criminal Case,5/29/2023 23:00,5/30/2023 12:00,1055 N 16th St,2023-05-30T14:15:00Z
23001743,VANDALISM - OTHER,5/30/2023 11:09,Closed - Inactive,5/27/2023 16:09,NULL,1801 R St,2023-05-30T11:09:00Z
23001737,TRESPASSING,5/28/2023 19:32,Closed - Non-Criminal Case,5/28/2023 19:32,NULL,433 V St,2023-05-28T19:32:00Z
23001735,AUTO THEFT,5/28/2023 04:05,Closed - Cleared by Arrest-Adult,5/28/2023 02:45,5/28/2023 03:05,1801 R St,2023-05-28T04:05:00Z
23001734,TRAFFIC - SUSPENDED DRIVER,5/28/2023 01:45,Closed - Cleared by Arrest-Adult,5/28/2023 01:45,NULL,N 13TH ST & P ST,2023-05-28T01:45:00Z
23001725,TRESPASSING,5/27/2023 10:04,Closed - Inactive,5/27/2023 00:41,5/27/2023 00:47,1100 T St,2023-05-27T10:04:00Z
23001724,ALCOHOL - DWI,5/27/2023 02:58,Closed - Cleared by Arrest-Adult,5/27/2023 02:58,NULL,530 N 17th St,2023-05-27T02:58:00Z
23001723,ALCOHOL - DRUNK,5/27/2023 02:10,Closed - Non-Criminal Case,5/27/2023 02:10,NULL,R ST & N 12TH ST,2023-05-27T02:10:00Z
23001722,TRAFFIC - SUSPENDED DRIVER,5/27/2023 01:28,Closed - Cleared by Arrest-Adult,5/27/2023 01:28,NULL,P ST & N 11TH ST,2023-05-27T01:28:00Z
23001713,LARCENY - STOLEN BIKE,5/25/2023 17:17,Closed - Inactive,5/25/2023 10:00,5/25/2023 16:00,1705 Arbor Dr,2023-05-25T17:17:00Z
23001704,OUTSIDE - O.P.S. OTHER,5/24/2023 09:24,Closed - Non-Criminal Case,NULL,NULL,240 N 17th ST,2023-05-24T09:24:00Z
23001700,"PROPERTY DAMAGE - UNINTENTIONAL,NON TRAFFIC",5/23/2023 17:03,Closed - Non-Criminal Case,5/23/2023 13:00,5/23/2023 16:30,844 N 16th St,2023-05-23T17:03:00Z
23001697,ACCIDENTS - P.D. NOT REPORTABLE,5/23/2023 12:21,Closed - Non-Criminal Case,5/23/2023 12:21,NULL,1100 T St,2023-05-23T12:21:00Z
23001691,TRESPASSING,5/22/2023 18:41,Closed - Non-Criminal Case,5/22/2023 18:41,NULL,1120 N 14th St,2023-05-22T18:41:00Z
23001688,DISTURBANCE - OTHER,5/22/2023 15:26,Closed - Non-Criminal Case,5/19/2023 13:21,5/22/2023 15:26,1215 U St,2023-05-22T15:26:00Z
23001687,TRAFFIC - OTHER,5/22/2023 14:54,Closed - Inactive,5/22/2023 14:54,NULL,R ST & N 16TH ST,2023-05-22T14:54:00Z
23001684,ACCIDENTS - P.D. H&R NOT REPORTABLE,5/22/2023 13:34,Closed - Inactive,5/20/2023 08:05,5/20/2023 12:30,1220 N 14th St,2023-05-22T13:34:00Z
23001686,TRESPASSING,5/22/2023 12:07,Closed - Non-Criminal Case,5/22/2023 12:07,NULL,1801 R St,2023-05-22T12:07:00Z
23001675,LARCENY - STOLEN BIKE,5/21/2023 17:29,Closed - Inactive,5/7/2023 18:00,NULL,440 N 17th St,2023-05-21T17:29:00Z
23001673,ACCIDENTS - P.D. NOT REPORTABLE,5/21/2023 12:02,Closed - Non-Criminal Case,5/21/2023 12:02,NULL,880 N 17th St,2023-05-21T12:02:00Z
23001671,TRESPASSING,5/21/2023 04:57,Closed - Non-Criminal Case,5/21/2023 04:57,NULL,630 N 14th St,2023-05-21T04:57:00Z
23001841,ACCIDENTS - P.D. NOT REPORTABLE,5/20/2023 23:14,Closed - Non-Criminal Case,5/20/2023 23:14,NULL,625 Stadium Dr,2023-05-20T23:14:00Z
23001670,ASSAULT - NON DOMESTIC,5/20/2023 21:44,Closed - Non-Criminal Case,5/20/2023 21:30,5/20/2023 21:44,1010 N 14th St,2023-05-20T21:44:00Z
23001669,ACCIDENTS - P.D. H&R NOT REPORTABLE,5/20/2023 13:30,Closed - Non-Criminal Case,5/19/2023 17:00,5/19/2023 22:00,1130 N 14th St,2023-05-20T13:30:00Z
23001668,ACCIDENTS - P.D. H&R NOT REPORTABLE,5/20/2023 12:28,Closed - Inactive,5/20/2023 11:56,5/20/2023 12:15,745 N 14th St,2023-05-20T12:28:00Z
23001664,ALCOHOL - DRUNK,5/20/2023 01:06,Closed - Non-Criminal Case,5/20/2023 01:06,NULL,N 17TH ST & Q ST,2023-05-20T01:06:00Z
